author,b_name,p_num,poems
bahar,mosammatbk,10,"انگور شد آبستن هان ای بچهٔ حور
برخیز و به گهواره فکن بچهٔ انگور
چندانش مهل کز دم دی گردد رنجور
کامد دی و افسرد دم ماه و دم هور
در هر باغ از برف و شاقی و نقیبی است
بر هر شاخ از زاغ خروشی و نعیبی است
شمشاد حبیبی و سیه زاغ رقیبی است
وز برف شبانه به سر سرو نصیبی است
آن سودهٔ سیم است که در دست نسیمست
وان کوه‌، بیندوده بدان سودهٔ سیم است
خورشید به‌ میغ اندر چون روی سقیم است
یا در بن دربا ید بیضای کلیم است
زین پیش چو عمال خزان باز رسیدند
وان خیمهٔ زربفت خزان باز کشیدند
دهقان پسران هر سو در باغ دویدند
جز از بچگان در وی جنبنده ندیدند
چون یافت کدیور گنه بچه گکان را
بربست به زنجیر دوگان را و سه گا‌ن را
وانگه به درون درشد و دید آن همگان را
وز آن همه گان پاک بپرداخت مکان را
بنهاد پس آن دخترکان را به سبد بر
برد آنهمه را تفت سوی خانهٔ خود بر
قومی دید آبست به پنجاه و به صد بر
مسکین به غلط رفت و گمان برد به بدبر
وانگاه نگه کرد بدان حال تبه‌شان
زان کرده پشیمان شد و بخشود گنهشان
وآورد ز چرخشت سوی خفتنگه‌شان
بر روی فرو بست ز هر بیهده رهشان
چون ماه چهارم شد، یک روز نهفته
بشتافت بدانجا که بدند آنان خفته
تا پرسد و جوید که چه بوده است و چه رفته
جوید خبر زان گره خستهٔ تفته
چون دید بدان بلعجبی گفت به‌ ناگاه
صد سبحان‌الله و دوصد سبحان‌الله
این جمله کیانند بدین آب و بدین جاه
نی خورشید اینجای فراز آمده نی ماه
اینانند آنان که دو سه ماه ازین پیش
آوردمشان از رز زی مصطبهٔ خویش
وانگه به لگد کردم پشت و برشان ریش
چونان بنهادمشان یک روز کم و بیش
امروز به صد عزت و تمکینند اینان
با دیگر رسم و دگر آئینند اینان
دلبند خوش و نغز و نگارینند اینان
گوئی مگر از خلخ و از چینند اینان
دهقان سپس ازکوشش و فریاد و هیاهو
پیش آرد مینائی پاکیزه چو مینو
برگیرد از آن بادهٔ نغز خوش نیکو
کز لاله ستدگونه و از مشگ ستد بو
نک آذرماه است و می حمری باید
بر شعر بهاری سمن‌بری باید
شاهان را آزادگی و حری باید
قطران شدم اینک ز تو بونصری باید
زال زمستان‌ گریخت از دم بهمن
آمد اسفند مه به فر تهمتن
خور به‌فلک ‌تافت‌ همچو رای ‌پشوتن
آتش زردشت دی فسرد به گلشن
قائد نوروز چتر آینه گون زد
ماه سفندار مذ طلایه برون زد
ساری منقار و ساق پای به خون زد
هدهد بر فرق تاج بوقلمون زد
ماه دگر نوبهار، جیش براند
از سپه دی سلاح‌ها بستاند
کل را بر تخت خسروی بنشاند
بلبل دستانسرا نشید بخواند
صدرا، ... خادم باشی
کرده به تکذیب من جفنگ تراشی
گوئی خود مرتشی نبوده و راشی
حیفست آنجا که دادخواه تو باشی
گر ره مدحش به پیش گیرم ننگست
ورکنمش هجو راه قافیه تنک است
صرف‌نظر گر کنم ز بسکه دبنگست
گوید پای کمیت طبعم لنگ است
گویم شاها شده است باشی پر لاف
از ره عدوان به عیب بنده سخن باف
چاره کنش گر به بنده باشدت الطاف
گویم و دارم یقین که از ره انصاف
تا که تبرّا بود به کار و تولّا
تا که پس از لا رسد سُرادق الا
خرّم و سرسبزمان به همت مولا
بر تو مبارک کند خدای تعالی
ای نگار روحانی‌، خیز و پرده بالا زن
در سوادق لاهوت کوس لا و الا زن
در ترانهٔ معنی دم ز سر مولا زن
وانگه از غدیر خم بادهٔ تولا زن
کز صفای او روشن جان باده‌ نوش آمد
در خم‌ غدیر امروز باده‌ای به جوش آمد
کان صنم که از عشاق برده عقل‌ و هوش آمد
وان مبشر رحمت باز در خروش آمد
آن حبیب و صد معراج‌،‌ آن کلیم و صد سینا
حیدر احد منظر احمد علی سیما
بزم قرب را محرم‌، راز غیب را دانا
در جمال او ظاهر سر علم‌الاسما
خاتم وفا را لعل‌، لعل راستی را کان
قلزم صفا را فلک‌، فلک صدق را سکان
اوست قطبی از اقطاب‌، اوست رکنی از ارکان
ممکنی است بی‌ایجاب‌، واجبی است بی‌امکان
در غدیر خم یزدان گفت مر پیمبر را
کز پی کمال دین شو پذیره حیدر را
پس پیمبر اندر دشت بر نهاد منبر را
برد بر سر منبر حیدر فلک فر را
گفت بشنوید ای قوم قول حق تعالی را
هم به جان بیاویزید گوهر تولا را
پوزش آورید از جان این ستوده مولی را
این وصی برحق را این ولی والا را
اوست کز خم لاهوت نشأهٔ صفا دارد
در خریطهٔ تجرید گوهر وفا دارد
در جبین و جان پاک نور کبریا دارد
در تجلی ادراک جلوهٔ خدا دارد
کی رسد به مدح او وهم مرد دانشمند
کی‌ توان به‌ وصف او دم‌زدن ز چون و چند
به که عجز مدح آرم از پدر سوی فرزند
حجت صمد مظهر آیت احد پیوند
پور موسی جعفر آیت‌اله اعظم
آنکه هست از انفاسش زنده عیسی مریم
در تحقق ذاتش گشته خلقت عالم
آفتاب کز رفعت بر فلک زند پرچم
عقل و وهم کی سنجند اوج کبریایش را
جان و دل چسان گویند مدحت و ثنایش را
گر رضای حق جویی رو بجو رضایش را
هرکه در دل افرازد رایت ولایش را
پادشاها ز ستبداد چه داری مقصود
که از این کار جز ادبار نگردد مشهود
جودکن در ره مشروطه که گردی مسجود
«‌شرف مرد به ‌جود است و کرامت به‌ سجود»
ملکا جور مکن پیشه و مشکن پیمان
که مکافات خدائیت بگیرد دامان
خاک بر سر کندت حادثهٔ دور زمان
«‌خاک مصر طرب‌انگیز نبینی که همان‌»
ملکا خودسری و جور تو ایران سوز است
به مکافات تو امروز وطن فیروز است
تابش نور مکافات نه از امروز است
«‌این‌همان چشمهٔ خورشیدجهان‌افروز است‌»
بیش از این شاها بر ربشهٔ خود تیشه مزن
خون ملت را در ورطهٔ ذلت مفکن
بیخ خود را به‌ هوا و هوس نفس مکن
«‌قیمت خود به ملاهی و مناهی مشکن‌»
کشت ملت راکردی ز ستم پاک درو
شدکهن قصهٔ چنگیز ز بیداد تو نو
به جهان دل ز چه‌بندی پس‌ازین گفت و شنو
«‌ای که در نعمت و نازی به جهان غره مشو»
بگذر از خطه تبریز و مقام شهداش
بشنوآن قصهٔ جانسوز و دل از غم بخراش
اندر آن خطه پس از آن کشش و آن پرخاش
«‌خاک راهی که بر آن می گذری ساکن باش‌»
شاه یک دل نشد وکار هباگشت و هدر
ملت خسته‌، درین مرحله کن فکر دگر
پای امید منه بر در شاه خود سر
«‌دست حاجت چو بری ییش خداوندی بر»
شاه خود کیست بدین کبر و انانیت او
تا نکو باشد دربارهٔ ما نیت او
ما پرستندهٔ حقیم و الوهیت او
« کز ثری تا به ثریا به عبودیت او»
سر زند کوکب مشروطه ز گردون کمال
به سر آید شب هجران و دمد صبح وصال
کار نیکو شود از فرّ خدای متعال
«‌ای که در شدت فقری و پریشانی حال‌»
جز خطاکاری ازین شاه نمی باید خواست
کانچه ما در او بینیم سراسر به خطاست
مدهش پند که بر بدمنشان پند هباست
«‌پند سعدی که کلید در گنج سعداست‌»
مژده که آمد برون خاطر ما ز انتظار
مژدهٔ فتح‌الفتوح داد به ما کردگار
حق در رحمت گشود بر دل امیدوار
فتح به ما شد قرین‌، بخت به ما گشت‌ یار
باز به ما یار گشت نصرت دادار ما
عاقبتی نیک داد کوشش بسیار ما
زار شد آن کس که بود در پی آزار ما
عرصهٔ گیهان گرفت فر سپهدار ما
همت ستار اگر عرصهٔ دنیا گرفت
فر سپهدار نیز اوج ثریا گرفت
کار مساواتیان یکسره بالا گرفت
مجلسِ رفته‌به‌باد بارِ دگر پا گرفت
ایزد قوت فزود ملت آزاد را
وانگه تأیید کرد سپهبد راد را
تا کند از بیخ و بن ریشهٔ بیداد را
گاه فزونی رسید معدلت و داد را
خائن دین‌خوار شد، زان یرش مردوار
عرصهٔ دربار را محنت و غم شد دچار
قهر خدائی کشید یکسره زایشان دمار
ملت آزاد کرد جنبش خویش آشکار
کوشش بدخواه ما یکسره شد بی‌اثر
خلع شد و طرد شد دشمن بیدادگر
به تخت شاهی نشست پادشه نامور
سلطان احمد که هست زینت تاج و کمر
تا که جهانست کار، به کام احرار باد
شاه جوانبخت را فضل خدا یار باد
دانش دانشوران پیشرو کار باد
مجلس مشروطه را خدا نگهدار باد
شاه نو بر تختگه ماوا گرفت
بار دیگر حق به مرکز جا گرفت
بار دیگر کار ما بالا گرفت
آتش اندر خصم بی‌پروا گرفت
کام مفسد مظهر خمیازه شد
شهر ظلم و جور بی‌دروازه شد
نام آزادی بلندآوازه شد
حمد یزدان‌، جان ملت تازه شد
آنکه کرد از نیکوئی کار وطن
آفرین‌ها بر سپهدار وطن
آنکه گشت از جان و دل یار وطن
نیز صد تحسین به سردار وطن
کار ما ترویج آئین است و بس
زین کشاکش قصد ما این است و بس
کام ما زین شهد، شیرین است وبس
ملجوئ ما حجت دین است و بس
روز شادی و سرور است ای بهار
چشم استبداد کور است ای بهار
عیش و شادی از تو دور است ای بهار
هم به تشویقت قصور است ای بهار
فلق لیل‌الفراق‌، وریح وصل تفوح
وصاح دیک‌الصباح‌، فقم لاجل‌الصبوح
زان می گلگون بیار، نهفته از عهد نوح
کوکب برج ظفر گوهر درج فتوح
خیز که آزادوار روز و شبان می زنیم
هرکه کند منع می تاخته بر وی زنیم
بر فرس پردلی بار دگر هی زنیم
ز آذر آبادگان یکسره بر ری زنیم
حضرت ستارخان‌، سپهبد نامدار
امیر نصرت پژوه‌، هژبر دشمن شکار
پیل دمان روز رزم‌، شیر ژیان وقت کار
تیغش مغفر شکاف‌، تیرش خفتان کذار
عین‌الدوله که بود دیدهٔ شه سوی او
پشت ستبدادیان گرم ز بازوی او
شاه به اسب و سوار فزود نیروی او
کرد به تبریز رخ جیش جهان جوی او
رسید و آغاز کار خواست به نیرنگ و رنگ
به حلیه آرد شتاب‌، به کوشش آرد درنگ
دید چو نیرنگ او نیک نبخشید رنگ
با سپه و تیپ ‌و توپ به‌ جنگ بگشود چنگ
فدائیان وطن هریک چون قسوره
فوجی در میمنه‌، فوجی در میسره
مرکز پیکار را گشت اجل دایره
گشت ز شلیک توپ کار عدو یکسره
مژده که بالا گرفت دولت ستارخان
شهره آفاق شد صولت ستارخان
کوس جلالت نواخت نصرت ستارخان
بار دگر در رسید نوبت ستارخان
کسان که کار جهان بهر خدا کرده‌اند
رایتی از معدلت بر سرپا کرده‌اند
حکم به حق رانده‌اند کار به جا کرده‌اند
وآنانک از عدل و داد روی فراکرده‌اند
زین گره بی‌خرد چشم نکوئی مدار
کشان ز بی‌دانشی گشته تبه روزگار
باش کزینان کشد قهر خدایی دمار
شعلهٔ قهر خدا زود شود آشکار
ای گره شه‌پرست روی به راه آورند
روی به راه آورید پشت به شاه آورید
لشکر ملت رسید، عذر گناه آورید
در کنف لطفشان جمله پناه آورید
زودا! زودا! که عدل منظره بالا زند
حضرت ستارخان خیمه به صحرا زند
پای تقدم نهد کوس معادا زند
توپ شرر بار او لطمه بر اعدا زند
همت ستارخان چون به وطن یار شد
باقر خانش ز جان یار وفادار شد
در همه‌جا یار او ایزد ستار شد
این یک سالار شد آن یک سردار شد
صورت کبر و نفاق شد ز تو پیراسته
صفحهٔ تاریخ دهر شد ز تو آراسته
بنشست از تیغ تو فتنهٔ برخاسته
قوت خصم تورا روز و شبان کاسته
تا تو گرفتی قبول از علمای نجف
فر تو پیشی گرفت از امرای سلف
نصرت و اقبال و جاه پیش تو بربست صف
گشته به تیر بلا سینهٔ خصمت هدف
هیچ دانی که چه کردیم به مادر من و تو
یا چه کردیم بهم‌، جان برادر من و تو
سعی کردیم به وبرانی کشور من و تو
رو، که اف بر تو و من باشد و تف بر من و تو
از همان اول‌، ما و تو بهم رنگ زدیم
وز سر جهل بهم حیله و نیرنگ زدیم
سنگ برداشته بر کلهٔ هم سنگ زدیم
گاه تریاک کشیدیم و گهی بنگ زدیم
مستبد گشتم و تو باز مساوات شدی
یا که من صاحب ثروت شده تو لات شدی
اعتدالی شده مخلص‌، تو دموکرات شدی
الغرض من چو تو لات و تو چو من مات‌ شدی
هرچه تو نقش زدی بنده زدم وارویش
هرچه مقصود تو شد، بنده دویدم رویش
تو رخ مام وطن کندی و من گیسویش
چشم او به نشده گشت خراب ابرویش
من به عنوان وکالت تو به عنوان دگر
جلب کردیم بسی فایده زبن مردم خر
نشد از ما و تو حاصل به کسی غیر ضرر
بلکه گشت ایران از روز نخستین بدتر
ای برادر تو خری من ز تو خرتر بالله
بهتر از ما و تو دانی چه بود؟ خر، بالله
خر به چاله ننهد پای مکرر بالله
زین خریت‌ها ویران شده کشور بالله
حرکت دادیم آغاز، دم وگردن و گوش
قاله قاله بفکندیم و نمودیم خروش
چونکه غیری به میان آمد گشتیم خموش
پیش بیگانه حقیریم و ذلیلیم چو موش
از پی مام وطن خوب عروسی کردیم
بهر این مرغک خود خوب خروسی کردیم
با مسلمانان آهنگ مجوسی کردیم
الغرض پر، خنکی کرده و لوسی کردیم
حالت ما و تو امروز چنین است بهار
روح مشروطه ز ما و تو غمین است بهار
ای بسا فتنه که ما را به کمین است بهار
روش و سیرت وکردار گر این است بهار
مژده که روی خدا ز پرده برآمد
آیت داور به خلق جلوه گر آمد
بی‌خبران را ز فیض کل خبر آمد
مظهرکل در لباس جزء درآمد
شعشعه گسترد جلوهٔ صمدانی
گشت عیان سرّ صادرات نهانی
طاق طلب را قویم گشت مبانی
شاهد غیبی رسید و داد نشانی
از فلک کون تافت اختر تجرید
نفس احد سرزد ازهیولی توحید
لم‌یلد امروز یافت کسوت تولید
آنکه بدو زنده گشت هر سه موالید
عقل نخستین بزرگ صادر اول
کالبد مستنیر و جان ممثل
راه بدی را یکی فروخته مشعل
هادی و مهدی سمی احمد مرسل
قاعده ‌پرداز کارگاه الهی
راز جهان را دلش خبیرکماهی
جاهش برتر ز حد لایتناهی
فکربه کنه جلال و قدرش واهی
شاهد غیبی و دلبر ازلی اوست
پرده‌نشین حریم لم‌یزلی اوست
باری سر خفی و نور جلی اوست
مرشد و مولا و پیشوا و ولی اوست
ای قمر تابناک برج امامت
وی گهر آبدار درج کرامت
ای به قد و قامت تو شور قیامت
خیز و برافراز یک ره آن قد و قامت
غیر تو ای کنز مخفی احدیت
کیست که پیدا کند کنوز هویت
از تو عیان است جلوه صمدیت
هیچ تو را با خدای نیست دوئیت
خیز و عیان کن به خلق جلوهٔ دادار
خیز که حق خفت و گشت باطل بیدار
گر نکنی پای در رکاب ظفر یار
منتظرانت زنند ای شه ابرار
زادهٔ موسی که طور اوست حریمش
عیسی گردون‌نشین غلام قدیمش
هر دو جهان ریزه‌خوار کف کریمش
آن که به فرمان واجب‌التعظیمش
خرگه ناسوت هست پایهٔ پستش
مسند لاهوت جایگاه نشستش
عقل خردمند گشته واله و مستش
غیرخدایش‌ مخوان که ‌هست ‌شکستش
ذاتش آئینهٔ خدای نما شد
گرچه خدا نیست کی جدا ز خدا شد
درگه او زیب بخش عرش علا شد
هر که به درگاه او ز روی صفا شد
شب است و بساط عیش، به خوبی مرتب است
شبی را که جان در او، به رقص آید امشب است
به هجران و وصل دوست‌، دل و تن مرکب است
دل از وصل در نشاط‌، تن از هجر در تب است
دل‌افروز ماه من کجایی که شب رسید
زمان تعب گذشت‌، اوان طرب رسید
عجم‌وار باده ده که عید عرب رسید
دل و جان بدسگال زمحنت به لب رسید
از این عید و جشن شد دل خسته شادمند
زهی عید دلفروز، زهی جشن ارجمند
ایا آنکه عارضت نشاطی است بی گزند
درین محفل سرور ز لب ده گلاب و قند
به شعبان مه ای ندیم‌، دل و جان منور است
بسی این خجسته ماه دلاویز و دلبر است
ز دیگر شهور دهر به رتبت فزونتر است
بلی افتخار او به فرزند حیدر است
حسین آنکه از رخش دل شیعه روشن است
به تاریکی ضلال‌، رخش نور معلن است
خود این گفتهٔ نبی به گیتی مبرهن است
که باشم من از حسین‌، حسین نیز از من است
به خاک در حسین ز جان انتساب ماست
به کویش امید ماست‌، به سویش حساب ماست
به تعدیل رای او صواب و عقاب ماست
حسین آسمان ماست‌، حسین آفتاب ماست
حسین آنکه حق ستود به فضل و تکرمش
حسین آنکه داد حق به گیتی تقدمش
فزود آبروی دین‌، ز خاک تیممش
خیال رخش به چرخ گذر کرد و انجمش
خوش آندم که بگذربم ز شادی به کوی او
بریم از سر نیاز دل و جان به سوی او
کنون از مزار طوس بجوئیم بوی او
که این چشمهٔ حیات بود زآب جوی او
رضا نور معلن است‌، رضا فیض مطلق است
رضا ماه روشن است‌، رضا شاه بر حق است
از او شرع پاک را جمال است و رونق است
بدو بازگشت ماست‌، بلی این محقق است"
