author,b_name,p_num,poems
bahar,tarjeebk,8,"شاهی به میان آمد و شاهی ز میان رفت
صد شکر که‌ این‌ آمد و صد حیف که آن رفت
تیری به کمان آمد بر قصد دل خصم
هم گر به خطا ناگه تیری ز کمان رفت
سلطان جوان آمد شاد و خوش و پیروز
وان انده دیرین ز دل پیر و جوان رفت
آمد ملکی راد که از آمدن او
از عیش‌، نوید آمد و از رنج‌، نشان رفت
در آمدن این شه و در رفتن آن شاه
بیتی به زبان آمد کاوّل به زبان رفت
المنّه لله که جهان باز جوان شد
وین شاه فلک مرتبه سلطان جهان شد
جم رتبه محمدعلی آن شاه جوان‌بخت
کز فر وی این ملک کهن گشته‌، جوان شد
شاهی که به عهدش به جهان فتنه اگر بود
در دیدهٔ فتان بتان رفت و نهان شد
بسترد کفش خاک غم از روی جهان لیک
خاک غم او بر سر گنجینه و کان شد
بگزید چو بر مسند و اورنگ پدر جای
این گفته ملک را به فلک ورد زبان شد
امروز به جز شادی کار دگری نیست
کز دوحهٔ‌ اندوه به جز انده ثمری نیست
زین‌ آمده‌ دل خوش کن و زان رفته مخور غم
کز آمده و رفتهٔ گیتی خبری نیست
ای ترک بدین مژده بده باده که امروز
ما را به جز این ره سوی وصلت گذری نیست
آنجا که تو را تیر نظر در پی صید است
اهل نظری نیست که صید نظری نیست
لیکن ز میان رفت حدیث تو که امروز
در دهر جز این نکته حدیث دگری نیست
هر روز به دست دگری تاج و نگین بود
تا هست چنین باشد و تا بود چنین بود
آمد ملکی کش غم ملک و غم دین است
بگذشت شهی کش غم ملک و غم دین بود
این شاه در ایوان شهی صدرنشین گشت
وآن شاه در ایوان شهی صدرنشین بود
برتخت شهی این شه منصور، مکین باد
چونان که مظفر شه مغفور، مکین بود
زین قصه‌ وز آن غصه‌ به هر جا که‌ سخن رفت
پایان سخن را چو بدیدی نه جز این بود
جشنی اگر امروز بدین مژده بباید
نیکوتر و زیباتر از این جشن نشاید
جشنی و به صدر اندر بنشسته امیری
کز خوی نکو زنگ غم از دل بزداید
فخرالامرا آصف دولت که ز جودش
حاتم به تحیر سر انگشت بخاید
فرمانده خاور که ز عدل و سخط او
تیهو بچه صید ازکف شاهین برباید
آراسته امروز یکی بزم که در وی
هر دم به میان این سخن نادره آید
تا هست جهان‌، خسرو ما شاه جهان باد
با فر جهانداری و با بخت جوان باد
دیروز ملک زاده و امروز ملک گشت
یک قرن چنین بود و دوصد قرن چنان باد
تا بود به عیش تن وآسایش جان بود
تا باد به عیش تن و اسایش جان باد
در سایهٔ او آصف دولت به خراسان
ایمن ز غم و محنت و آسیب زمان باد
وین بنده بهارش به جهان مدح سراباد
وین گفته ز من در سخن خلق روان باد
می ده که طی شد دوران جانکاه
آسوده شد ملک‌، الملک‌لله
شد شاه نو را اقبال همراه
کوس شهی کوفت بر رغم بدخواه
یک چند ما را غم رهنمون شد
جان یار غم گشت‌،‌ دل غرق خون شد
مام وطن را رخ نیلگون شد
و امروز دشمن خوار و زبون شد
چندی ز بیداد فرسوده گشتیم
با خاک و با خون آلوده گشتیم
زیر پی خصم پیموده گشتیم
و امروز دیگر آسوده گشتیم
آنان که ما را کشتند و بستند
قلب وطن را از کینه خستند
از کج نهادی پیمان شکستند
از چنگ ملت آخر نجستند
آنان که با جور منسوب گشتند
در پیکر ملک میکروب گشتند
آخر به ملت مغضوب گشتند
از ساحت ملک جاروب گشتند
چون کدخدا دید جور شبان را
از جا برانگیخت ستارخان را
سدّ ستم ساخت آن مرزبان را
تا کرد رنگین تیغ و سنان را
پس مستبدین لختی جهیدند
گفتند لختی‌، لختی شنیدند
ناگه ز هر سو شیران رسیدند
آن روبهان باز دم درکشیدند
یک سو سپهدار شد فتنه را سد
یک سو یورش برد سردار اسعد
ضرغام پر دل‌، آمد ز یک حد
بر کف گرفتند تیغ مهند
اقبال شد یار با بختیاری
گیلانیان را حق کرد یاری
جیش عدو شد یکسر فراری
در کنج غم گشت دشمن حصاری
بد خواه دین را سدی متین بود
لیکن مر او را غم در کمین بود
خاکش به سر شد پاداشش این بود
دشمن که با عیش دایم قرین بود
بخت سپهدار فرخنده بادا
سردار اسعد پاینده بادا
صمصام ایران برنده بادا
ضرغام دین را دل زنده بادا
ستارخان را بادا ظفر یار
تبریزیان را یزدان نگهدار
سالارشان را نیکو بود کار
احرار را نیز دل باد بیدار
چندگویی چرا مانده ویران
هند و افغان و خوارزم و ایران
چندگویی چرا جسته مأوا
خرس پتیاره بر جای شیران
چندگویی چرا روز حاجت
مانده ازکار، دست دلیران
چندگویی چرا ما اسیریم
زانکه آزادی ما اسیران
ثروت وملک و ناموس ومذهب
چار چیز است در ما مرکب
ثروت و ملک و ناموس ما را
برده این اختلافات مذهب
اختلافات مذهب در اسلام
روزما را سیه کرده چون شب
عزت ما به دو چیز بسته است
اتحاد اول و بعد مکتب
اجنبی یارگردد نگردد
خصم‌، غمخوارگردد نگردد
آنکه بیمار را زهر داده است
خود پرستارگردد نگردد
وآنکه صد بی‌وفایی به ماکرد
او وفادارگردد نگردد
زبن خرابی که درکار ما هست
سخت‌تر کار گردد نگردد
هند و ترکیه و مصر و ایران
تونس و فاس و قفقاز و افغان
در هویت دو، اما به دین‌، یک
مختلف‌، تن ولی متحد، جان
جملگی پیرو دین احمد
جملگی تابع نص قرآن
مسلمی گر بگرید به طنجه
مؤمنی نالد اندر بدخشان
وقت حق‌خواهی و حقگزاری‌ست
روز دینداری و روز یاری است
حکم اسلام و حکم پیمبر
بر تو و او و ما جمله جاری است
ما و اویی نباشد در اسلام
کاین سخن‌ها ز دشمن شعاری است
چار یار نبی صلح بودند
زین سبب جنگ ما و تو خواری است
ای فلک آل علی را از وطن آواره کردی
زان سپس در کربلاشان بردی و بیچاره کردی
تاختی از وادی ایمن غزالان حرم را
پس اسیر پنجهٔ گرگان آدمخواره کردی
جسم پاک شیرمردان را نمودی پاره پاره
هم دل شیر خدا را زین مصیبت پاره کردی
گوشوار عرش رحمن را بریدی سر، پس آنکه
دخترانش را ز کین بی‌گوشوار و یاره کردی
جبههٔ فرزند زهرا را ز سنگ کین شکستی
تو مگر ای آسمان‌! دل‌را ز سنگ‌خاره کردی
تا کنی خورشید عصمت را به ابر کینه پنهان
دشت را ز اعدای دین پرثابت و سیاره کردی
جورها کردی از اول در حق پاکان ولیکن
در حق آل پیمبر جور را یکباره کردی
کودکی دیدی صغیر اندر میان گاهواره
چون ‌نکردی شرم‌ و ازکین قصد آن گهواره کردی
چاره می‌جستند در خاموشی آن طفل گریان
خود تو در یک ‌لحظه از پیکان ‌تیرش چاره کردی
سوختی از آتش کین خانهٔ آل علی را
وایستادی بر سر آن آتش و نظاره کردی
آسمانا جز به کین آل پیغمبر نگشتی
تا نکشتی آل زهرا را از این ره برنگشتی
چون فکندی آتش کین در حریم آل یسین
ز آه آتش بارشان چون شد که خاکستر نگشتی
چون بدیدی مسلم اندر کوفه بی‌یار است و یاور
از چه‌رو او را در آن بی‌یاوری یاور نگشتی
چون دو طفل مسلم اندر کوفه گم کردند ره را
از چه آن گمگشتگان را جانبی رهبر نگشتی
چون به زندان عبیداله فتادند آن دو کودک
از چه‌ رو غمخوار آن دو کودک مضطر نگشتی
چون تن آن کودکان از تیغ حارث گشت بی‌سر
از چه ‌رو بی‌تن نگشتی از چه‌ رو بی‌سر نگشتی
چون شدند آن کودکان از فرقت مادر گدازان
از چه رو برگرد آن طفلان بی‌مادر نگشتی
چون حسین‌بن علی با لشکرکین شد مقابل
از چه پشتیبان آن سلطان بی‌لشکر نگشتی
چون دچار موج غم شد کشتی آل محمد
از چه رو ای زورق بیداد! بی‌لنگر نگشتی
ای دل ز جفای دیده یاد آر
زان اشک به ره چکیده یاد آر
این نکتهٔ ناگزیر بشنو
وین قصهٔ ناشنیده یاد آر
زین ملک ستم کشیده‌، یعنی
ز ایران تعب کشیده یاد آر
ز آن روزکه اشکبار بودی
درگوشهٔ غم خزیده یاد آر
امروزکه زخم یافت مرهم
زان جسم به خون طپیده یاد آر
گرکسوت نو بریده‌ای باز
زان پیرهن دریده یاد آر
امروز که چهر بخت دیدی
زان عارضهٔ ندیده یاد آر
امروزکه شد بهار پیدا
زان باغ خزان رسیده یاد آر
هر وقت که قصد کار کردی
این یک بیت گزیده یاد آر:
یک چند شد از جفای اشرار
بنیاد بقای ما نگونسار
یک چند بهر دیار و هر شهر
گشتیم قتیل تیغ اشرار
با اینکه به حق حق نبودیم
در هیچ طریقه‌ای گنه کار
تا آنکه مجاهدین دانا
ما راگشتند ناصر و یار
از خطهٔ مرد خیز تبریز
بر بست میان‌، گزیده ستار
ازکشور رشت نیز برخاست
آوازهٔ حضرت سپهدار
صمصام برآمد از صفاهان
سید عبدالحسین از لار
از شاه حقوق خویشتن را
کردند طلب به جهد بسیار
امروزکه رنج برطرف گشت
ای ملت رنجدیده زنهار
در جهل مباش و دانش اندیش
کز جهل نرفت کاری از پیش
زنهار به فکر کار خود باش
بیگانه چنین مباش از خویش
با داروی فکر تا توانی
می کوش به مرهم دل ریش
در فکر وکیل باهنر باش
لیکن نه به طرز دورهٔ‌ پیش
خود شرط وکیل نیست امروز
قطر تنه و درازی ریش
از ظاهر بی‌درون حذر کن
وز عالم بی‌عمل بیندیش
امروزکه روز نیک‌بختی است
می‌کوش به نیک‌بختی خویش
امروز درست باید انداخت
تیری که نهفته‌ایم در کیش
گر زانکه خدنگ بر خطا رفت
گردیم نشان تیز تشویش
پندی دهمت ز خیرخواهی
از جان بنیوش پند درویش
شد لطف خدا به خلق شامل
افتاد به‌دست‌، مقصد دل
شد از پس جهدهای بسیار
امروز مراد ملک حاصل
امروز که روز کاردانی است
چندین منشین ز کار عاطل
بی‌حیله و دست کاری و مکر
یک ره بگزین وکیل عامل
نادان چو مواضعت نماید
دانا افتد به دام هایل
کی آنکه به‌قصد جاه و مال است
در کار وکالت است قابل
بایست وکیل ممتحن جست
با خاطر پاک و رای مقبل
ورنه ز هجوم طعنهٔ خلق
عاطل گردد وکیل باطل
گفتار بهار خسته‌دل را
بشنو، بشنو به حس کامل
بودم روزی به شهر تبریز
آقا و ولی عهد و با چیز
شه هرمز بود و بنده پرویز
و اینک شده‌ام ز دیده خونریز
بودم روزی به شهر تهران
مولا و خدایگان و سلطان
بستم همه را به توپ غران
گفتم که کسی نماند از ایشان
گفتیم که خلق حرف مفتند
آخر دیدیم دم کلفتند
خیلی گفتیم وکم شنفتند
یک جنبش سخت کرده گفتند
گفتیم که ما ز گندگانیم
زحمت ز خدا به بندگانیم
سوی ادسا شوندگانیم
غم نیست که از روندگانیم
سوی ادسا شدیم هی هی
مجنون‌آسا شدیم هی هی
بی‌برگ و نوا شدیم هی هی
یکباره فنا شدیم هی هی
اندر ادسا قزی جمیله
آمد چون لیلی ازقبیله
مجنون شدمش بلا وسیله
بگذاشت به گوش من فتیله
بدبختی ما نگر که خانم
ناداد دگر به دست ما دم
یک روز و دو روز بود و شد گم
با خودگفتیم خسروا قم
بر یاد نگار عیسوی کیش
کردیم سفر به ملک اطریش
درویشانه گذشتم از خویش
کز عشق‌، شهان شوند درویش
خانم ز نظر برفت باری
مقصود سفر برفت باری
وقتم به هدر برفت باری
چون عشق ز سر برفت باری
دیدیم به شهر قال و قیل است
صحبت زنگار بی‌بدیل است
وز ما سخنان بس طویل است
گفتیم که نام ما خلیل است
با خود گفتیم ممدلی هی
وقت سفر است یا علی هی
برخیز و برو مگر شلی هی
خود را آماده کن ولی هی
آنکس که تو راست میهماندار
بسیار رفیق تو است بسیار
از توپ و تفنگ و جیش جرار
همره کندت‌، مترس زنهار
وانگاه ز شهر «‌ماربنباد»
رفتیم به بادکوبه دلشاد
صاحبخانه نوید می‌داد
می‌‎گفت برو به استرآباد
گفتم قلی اف بیا بیا زود
آماده بکن یکی پاراخود
نامرد به قیمتش بیفزود
من نیز قبول کردم از جود
وانگاه به رسم میهمان‌ها
رفتیم به ایل ترکمان‌ها
دادیم نویدها به آنها
گفتیم که ای عزیز جان‌ها
گفتم سخنان به مکر و فن‌ها
پختم همه را از آن سخن‌ها
خوش داد نتیجه ما و من‌ها
این نقشه نه خوب گشت تنها
من ممدلی گریز پایم
با دولت روس آشنایم
تهران تو کجا و من کجایم
خواهم که به جانب تو آیم
ای ترکمنان نیک‌منظر
ریزید به شهر و قلعه ‌یکسر
چاپید هرآنچه اسب و استر
زآغوش پدر کشید دختر
وانگاه دو اسبه با دل شاد
رفتیم به شهر استرآباد
کردیم علم چماق بیداد
گفتیم که هرکه پیشکش داد
«‌ارشد» که چو ما نشد هراسان
شد عازم شاهرود و سمنان
از سوی دگر رشید سلطان
شد از ره راست سوی تهران
خود گرچه ز شوق تیز بودیم
در وحشت وترس نیز بودیم
هردم به سرگریز بودیم
هر لحظه بجست و خیز بودیم
گفتند که کارها شلوغ است
وین کهنه چراغ بی‌فروغ است
سرمایهٔ ارتجاع دوغ است
گفتیم که جملگی دروغ است
گفتندکه کشته شد رشیدت
گفتند که پاره شد امیدت
گفتند وعید شد نویدت
گفتند سیاه شد سفیدت
گفتند که خصم کینه‌خواه است
بدخواه به راه و نیمه راه است
قصد همگی به قتل شاه است
دیدیم‌.که روز ما سیاه است
گفتندکه ارشدت جدو شد
وان میر مکرمت کتو شد
اردوی منظ‌مت چپو شد
هنگام بدو بدو بدو شد
گفتند جناب حکمفرما
زحمت چکسوز دگر بفرما
برگرد کجا که بودی آنجا
دیدم زین بیش جنگ و دعوا
بنمود زمانه هرزه پوئی
وین گردون کرد تیره‌روئی
افکند مرا به مرده‌شوئی
گفتیم مگر که جنگجوئی
امروز ز بخت در گله استم
درگیر شکنجه و تله استم
درکار فرار و ولوله استم
گر بنده امیر قافله استم
ماه مشروطه در این ملک طلوعیدن کرد
انتخابات دگر بار شروعیدن کرد
شیخ در منبر و محراب خشوعیدن کرد
حقه و دوز وکلک باز شیوعیدن کرد
صاحب‌الرأیا! رو صبح‌نشین روی خرک
رأی‌ها پیش نه و داد بزن های جگرک
پوت قند آید ازبهرتو و توپ برک
می‌دود پیشتر و می‌دهدت پیشترک
این وکالت نه به‌آزادی و خوش تعلیمی است
نه به دانستن تاریخ و حقوق و شیمی است
بلکه در تنبلی وکم‌دلی و پربیمی است
یا بپوطین و کلاه و فکل و تعلیمی است
تو برو جا به دل مردم بازاری کن
گه ز خودگاه ز من یاد به هشیاری کن
گر وکالت به من افتاد تو پاداری کن
ور به اسم تو درآمد تو ز من یاری کن
حضرت آقا خوش باشکه فالت فال است
از زر و سیم دگر جیب تو مالامال است
هرکه آقاست نکو طالع و خوش اقبالست
گه نمایندگی مجلس و قیل و قال است
طرفه عهدیست که هرگوشه کنی روی فراز
هرکه دزدی نکند همسر خار و خشک است
نه ادارات مبراست نه محراب نماز
انتخابات شد و اول دوز و کلک است
نوبهارا بود اندر سخنانت نمکی
اف برآن کاورد اندر سخنان توشکی
هرچه داری ده و بستان ز وکالت کمکی
ملک‌هایی که تو بینی همه دارد درکی
در دست کسانی است نگهبانی ایران
کاصرار نمودند به ویرانی ایران
آن قوم‌، سرانند که زیر سر آنهاست
سرگشتگی و بی‌سرو سامانی ایران
الحق که خطا کرده و تقصیر نمودند
این سلسله در سلسله جنبانی ایران
در سلطنت مطلقه چندی پدرانشان
بردند منافع ز پریشانی ایران
نعم‌الخلفان نیز درین دورهٔ فترت
ذیروح شدند از جسد فانی ایران
پامال نمودند و زدودند و ستردند
آزادی ایران و مسلمانی ایران
کشتند بزرگان را و ابقا ننمودند
بر شیخ حسین و به خیابانی ایران‌
کشت ‌آن‌ حسن از بهر وطن‌، گر دو سه کاشی
کشت این ‌حسن احرار وطن را چو مواشی
تقلید از او کرد و ندانست و خطا کرد
آری در کهدان شکند سارق ناشی
این صاحب کابینه و آن والی تبریز
صدری که چنین است چنانند حواشی
گه ‌قتل مهین شیخ حسین‌خان را در فارس
تصویب نمودند به صد عذرتراشی
گه بر سرتبریز دویدند و نمودند
قانون اساسی را از هم متلاشی
در سایهٔ قانون سر قانون‌طلبان را
از تن ببریدند و نکردند تحاشی
آوخ اگر ارواح شهیدان به قیامت
گیرند گریبان نژاد لله‌باشی
دریوزه گری کوفت در صاحب‌خانه
وانگاه برفت از اثر صاحب خانه
از کثرت تلبیس و ریا کرد به خود جلب
چون گربهٔ عابد نظر صاحب خانه
از بهرگدایی شد و چون خانه تهی دید
بگرفت به حجت کمر صاحب خانه
دژخیم خیابانی ازین قسم به تبریز
وارد شد و شد حمله‌ور صاحب خانه
با آنکه در افواه عوام است که مهمان
من‌باب مثل هست خر صاحب خانه
این نره‌خران لگدانداز شتر کین
جستند به دیوار و در صاحب خانه
در خانهٔ احرار شدند، از ره اصرار
مهمان و بریدند سر صاحب خانه
رندان به گمانشان که شکاری سره کردند
وز قتل مهمان‌، کار جهان یکسره کردند
روبه‌صفتان بین که چسان پنجه خونین
از فرط سفه درگلوی قسوره کردند
آزادی را بلهوسان ملعبه کردند
حریت را بی‌خردان مسخره کردند
راندند ز خون شهدا سیل و بر آن سیل
از نعش بزرگان وطن قنطره کردند
قصری زخیانت بنهادند و بر آن قصر
از لخت دل سوختگان کنگره کردند
وانگه پی تنویر شبستان شقاوت
از تیر جفا، سینهٔ ما پنجره کردند
وز کینه شبانگاه‌، تجددطلبان را
کشتند و تو گویی عملی نادره کردند
جمعی پی ترحیم خیابانی مظلوم
اجلاس نمودند نجیبانه درین بوم
رسم‌ است که‌ چون‌ مُرد مسلمان‌،‌ پی ترحیم
قرآن به دعا ختم کند امت مرحوم
جز آنکه مسلمان نبود یا که نباشند
حکام مسلمان و مسلمانی مرسوم
چون مرده مسلمان بود و زنده مسلمان
از ختم و عزا منع حرام آید و مذموم
این بلعجبی بین که به‌جد حمله نمودند
بر مجلس ترحیم خیابانی مظلوم
بستند ره آمد و شد را به رخ خلق
وابداع نمودند ز نو قاعده‌ای شوم
غافل که ازین حرکت مذبوح‌، نگردد
آزادی معدوم و ستمکاری مکتوم
از آستی ار دست حقیقت به در آید
این دستگه غیر طبیعی به سر آید
رخسار بپوشند وجیهان ریاکار
گر چهر حقیقت ز پس پرده درآید
ای قاتل آزادی ایران به حذرباش
زان لحظه که قاضی به‌سر محتضر آید
پر گیرد و در بارگه عدل بنالد
این روح کزین کالبد خسته برآید
ملت بود آن شیر که هنگام تزاحم
چون بیشتر آزرده شود پیشتر آید
ای پیر مکن گریه که هنگام مکافات
از روح جوان تو بر تو خبر آید
وی کودک نالان پدر کشتهٔ مسکین
زاری مکن امروز که روز دگر آید"
