author,b_name,p_name,text
eraghi,eraghi,eraghi,"
بیا، که عمر من خاکسار می‌گذرد
مدار منتظرم، روزگار می‌گذرد
بیا، که جان من از آرزوی دیدارت
به لب رسید و غم دل فگار می‌گذرد
بیا، به لطف ز جان به لب رسیده بپرس
که از جهان ز غمت زار زار می‌گذرد
بر آن شکسته دلی رحم کن ز روی کرم
که ناامید ز درگاه یار می‌گذرد
چه باشد ار بگذاری که بگذرم ز درت؟
که بر درت ز سگان صدهزار می‌گذرد
مکش کمان جفا بر دلم، که تیر غمت
خود از نشانهٔ جان بی‌شمار می‌گذرد
من ار چه دورم از درگهت دلم هر دم
بر آستان درت چندبار می‌گذرد
ز دل که می‌گذرد بر درت بپرس آخر:
که آن شکسته برین در چه کار می‌گذرد
مکش چو دشمنم، ای دوست ز انتظار، بیا
که این نفس ز جهان دوستدار می‌گذرد
به انتظار مکش بیش ازین عراقی را
که عمر او همه در انتظار می‌گذرد
پشت بر روزگار باید کرد
روی در روی یار باید کرد
چون ز رخسار پرده برگیرد
در دمش جان نثار باید کرد
پیش شمع رخش چو پروانه
سوختن اختیار باید کرد
از پی یک نظاره بر در او
سال‌ها انتظار باید کرد
تا کند یار روی در رویت
دلت آیینه‌وار باید کرد
تات در بوته‌زار بگدازد
قلب خود را عیار باید کرد
تا نهد بر سرت عزیزی پای
خویش، چون خاک خوار باید کرد
ور تو خود را ز خاک به دانی
خود تو را سنگسار باید کرد
تا دهی بوسه بر کف پایش
خویشتن را غبار باید کرد
دشمنی کت ز دوست وا دارد
زودت از وی فرار باید کرد
ور ز چشمت نهان بود دشمن
پس دو چشمت چهار باید کرد
دشمن خود تویی، چو در نگری
با خودت کارزار باید کرد
چون عراقی ز دست خود فریاد
هر دمت صدهزار باید کرد
یاد آن شیرین پسر خواهیم کرد
کام جان را پرشکر خواهیم کرد
دامن از اغیار در خواهیم چید
سر ز جیب یار بر خواهیم کرد
آفتاب روی او خواهیم دید
گر به مه روزی نظر خواهیم کرد
بوی جان افزای او خواهیم یافت
گر به گلزاری گذر خواهیم کرد
در خم زلفش نهان خواهیم شد
دست با وی در کمر خواهیم کرد
چون کمان ابروان پر زه کند
پیش تیرش جان سپر خواهیم کرد
از حدیث یار و آب چشم ما
گوش و دامن پر گهر خواهیم کرد
ماجرایی رفت ما را با لبش
دوستان را زان خبر خواهیم کرد
تا عراقی نشنود اسرار ما
ماجرا را مختصر خواهیم کرد
می روان کن ساقیا، کین دم روان خواهیم کرد
بهر یک جرعه میت این دم روان خواهیم کرد
دردیی در ده، کزین جا دردسر خواهیم برد
ساغری پر کن، که عزم آن جهان خواهیم کرد
کاروان عمر ازین منزل روان شد ناگهی
چون روان شد کاروان، ما هم روان خواهیم کرد
چون فشاندیم آستین بی‌نیازی بر جهان
دامن ناز اندر آن عالم کشان خواهیم کرد
از کف ساقی همت ساغری خواهیم خورد
جرعه‌دان بزم خود هفت آسمان خواهیم کرد
تا فتد در ساغر ما عکس روی دلبری
ساغر از باده لبالب هر زمان خواهیم کرد
درچنین مجلس که می‌عشق است‌و ساغربیخودی
نالهٔ مستانه نقل دوستان خواهیم کرد
تا درین عالم نگردد آشکارا راز ما
ناگهی رخ را ازین عالم نهان خواهیم کرد
نزد زلف دلربایش تحفه، دل خواهیم برد
پیش روی جانفزایش جان فشان خواهیم کرد
چون بگردانیم رو، زین عالم بی‌آبرو
روی در روی نگار مهربان خواهیم کرد
بر سر بازار وصلش جان ندارد قیمتی
تا نظر در روی خوبش رایگان خواهیم کرد
سالها در جستجویش دست و پایی می‌زدیم
چون نشان دیدیم، خود را بی‌نشان خواهیم کرد
هر چه ما خواهیم کردن او بخواهد غیر آن
آنچه آن دلبر کند ما خود همان خواهیم کرد
عراقی هیچ خواهد گفت: اناالحق، این زمان
بر سر دارش ز غیرت ناگهان خواهیم کرد
روی ننمود یار چتوان کرد
نیست تدبیر کار، چتوان کرد؟
بر درش هر چه داشتم بردم
نپذیرفت یار، چتوان کرد؟
از گل روی یار قسم دلم
نیست جز خارخار، چتوان کرد؟
بوده‌ام بر درش عزیز بسی
گشتم این لحظه خوار، چتوان کرد؟
بر مراد دلم نمی‌گردد
گردش روزگار چتوان کرد؟
غم بسیار هست و نیست دریغ،
با غمم غمگسار چتوان کرد؟
از پی صید دل نهادم دام
لاغر آمد شکار، چتوان کرد؟
چند باشی، عراقی، از پس دل
درهم و سوکوار، چتوان کرد؟
روی ننمود یار چتوان کرد؟
چیست تدبیر کار چتوان کرد؟
در دو چشم پر آب نقش نگار
چون نگیرد قرار چتوان کرد؟
در هر آیینه‌ای نمی‌گنجد
عکس روی نگار چتوان کرد؟
هر سراسیمه‌ای نمی‌یابد
بر در وصل بار چتوان کرد؟
رفت عمرو نرفت در همه عمر
دست در زلف یار چتوان کرد؟
کشت ما را به دوستی، چه کنیم
با چنان دوستدار چتوان کرد؟
کشتهٔ عشق اوست بر در او
چون عراقی هزار، چتوان کرد؟"
eraghi,eraghi,eraghi,"
من رنجور را یک دم نپرسد یار چتوان کرد؟
نگوید: چون شد آخر آن دل بیمار چتوان کرد؟
تنم از رنج بگدازد، دلم از غم به جان آرد
چنین است، ای مسلمانان مرا غمخوار چتوان کرد؟
ز داروخانهٔ لطفش چو دارو جان نمی‌یابد
بسازم با غم دردش بنالم زار چتوان کرد؟
دلا، بر من همین باشد که جان در راه او بازم
اگر آن ماه ننماید مرا رخسار چتوان کرد؟
چو از خوان وصال او ندارم جز جگر قوتی
بخایم هم از بن دندان جگر ناچار چتوان کرد؟
سحرگاهان به کوی او بسی رفتم به بوی او
بسی گفتم: قبولم کن، نکرد آن یار چتوان کرد؟
چنان نالیدم از شوقش که شد بیدار همسایه
ز خواب این دیدهٔ بختم نشد بیدار چتوان کرد؟
مرا چون نیست از عشقش به جز تیمار و غم روزی
ضرورت می‌خورم هر دم غم و تیمار چتوان کرد؟
عراقی نیک می‌خواهد که فخر عالمی باشد
ولیکن یار می‌خواهد که باشد عار چتوان کرد؟
از در یار گذر نتوان کرد
رخ سوی یار دگر نتوان کرد
ناگذشته ز سر هر دو جهان
بر سر کوش گذر نتوان کرد
زان چنان رخ، که تمنای دل است
صبر ازین بیش مگر نتوان کرد
با چنین دیده، که پرخوناب است
به چنان روی نظر نتوان کرد
چون حدیث لب شیرینش رود
یاد حلوا و شکر نتوان کرد
سخن زلف مشوش بگذار
دل ازین شیفته‌تر نتوان کرد
قصهٔ درد دل خود چه کنم؟
راز خود جمله سمر نتوان کرد
غم او مایهٔ عیش و طرب است
از طرب بیش حذر نتوان کرد
گرچه دل خون شود از تیمارش
غمش از سینه به در نتوان کرد
ابتلایی است درین راه مرا
که از آن هیچ خبر نتوان کرد
گفتم: ای دل، بگذر زین منزل
محنت آباد مقر نتوان کرد
گفت: جایی که عراقی باشد
زود از آنجای سفر نتوان کرد
بدین زبان صفت حسن یار نتوان کرد
به طعمهٔ پشه عنقا شکار نتوان کرد
به گفتگو سخن عشق دوست نتوان گفت
به جست و جو طلب وصل یار نتوان کرد
بدان مخسب که در خواب روی او بینی
خیال او بود آن، اعتبار نتوان کرد
دو چشم تو، خود اگر عاشقی، پر آب بود
بر آب نقش لطیف نگار نتوان کرد
به چشم او رخ او بین، به دیدهٔ خفاش
به آفتاب نظر آشکار نتوان کرد
به چشم نرگس کوته‌نظر به وقت بهار
نظارهٔ چمن و لاله‌زار نتوان کرد
شدم که بوسه زنم بر درش ادب گفتا
به بوسه خاک در یار خوار نتوان کرد
به نیم جان که تو داری و یک نفس که تو راست
حدیث پیشکشش زینهار نتوان کرد
چه به که پیش سگان درش فشانی جان
که این متاع بر آن رخ نثار نتوان کرد
بلا به پیش خیالش شبی همی گفتم
که : دشمنی همه با دوستدار نتوان کرد
بگوی تا نکند زلف تو پریشانی
که بیش ازین دل ما بی‌قرار نتوان کرد
به تیغ غمزهٔ خون خوار، جان مجروحم
هزار بار، به روزی فگار نتوان کرد
دلی که با غم عشق تو در میان آمد
بهر گنه ز کنارش کنار نتوان کرد
بدان که نام وصال تو می‌برم روزی
به دست هجر مرا جان سپار نتوان کرد
جواب داد خیالش که، با سلیمانی
برای مورچه‌ای کارزار نتوان کرد
میان هجر و وصالش، گر اختیار دهند
ز هر دو هیچ یکی اختیار نتوان کرد
رموز عشق، عراقی، مگو چنین روشن
که راز خویش چنین آشکار نتوان کرد
بتم از غمزه و ابرو، همه تیر و کمان سازد
به غمزه خون دل ریزد به ابرو کار جان سازد
چو در دام سر زلفش همه عالم گرفتار است
چرا مژگان کند ناوک چرا ابرو کمان سازد؟
خرابی ها کند چشمش که نتوان کرد در عالم
چه شاید گفت با مستی که خود را ناتوان سازد؟
دل و جان همه عالم فدای لعل نوشینش
که چون جام طرب نوشد دو عالم جرعه‌دان سازد
غلام آن نگارینم که از رخ مجلس افروزد
لب او از شکر خنده شراب عاشقان سازد
بتی کز حسن در عالم نمی‌گنجد عجب دارم
که دایم در دل تنگم چگونه خان و مان سازد؟
عراقی، بگذر از غوغا، دلی فارغ به دست آور
که سیمرغ وصال او در آنجا آشیان سازد
چنین که غمزهٔ تو خون خلق می‌ریزد
عجب نباشد اگر رستخیز انگیزد
فتور غمزهٔ تو صدهزار صف بشکست
که در میانه یکی گرد برنمی‌خیزد
ز چشم جادوی مردافگن شبه رنگت
جهان، اگر بتواند، دو اسبه بگریزد
فروغ عشق تو تا کی روان من سوزد
فریب چشم تو تا چند خون من ریزد؟
مرنج، اگر به سر زلف تو در آویزم
که غرقه هرچه ببیند درو بیاویزد
تو را، چنان که تویی، تا کسیت نشناسد
رخ تو هر نفسی رنگ دیگر آمیزد
اگر چه خون عراقی بریزی از دیده
به خاکپای تو کز عشق تو نپرهیزد"
eraghi,eraghi,eraghi,"
اگر یکبار زلف یار از رخسار برخیزد
هزاران آه مشتاقان ز هر سو زار برخیزد
وگر غمزه‌اش کمین سازد دل از جان دست بفشاند
وگر زلفش برآشوبد ز جان زنهار برخیزد
چو رویش پرده بگشاید که و صحرا به رقص آید
چو عشقش روی بنماید خرد ناچار برخیزد
صبا گر از سر زلفش به گورستان برد بویی
ز هر گوری دو صد بی‌دل ز بوی یار برخیزد
نسیم زلفش ار ناگه به ترکستان گذر سازد
هزاران عاشق از سقسین و از بلغار برخیزد
نوای مطرب عشقش اگر در گوش جان آید
ز کویش دست بفشاند قلندروار برخیزد
چو یاد او شود مونس ز جان اندوه بنشیند
چو اندوهش شود غم خور ز دل تیمار برخیزد
دلا بی‌عشق او منشین ز جان برخیز و سر در باز
چو عیاران مکن کاری که گرد از کار برخیزد
درین دریا فگن خود را مگر دری به دست آری
کزین دریای بی‌پایان گهر بسیار برخیزد
وگر موجیت برباید، زهی دولت، تو را آن به
که عالم پیش قدر تو چو خدمتکار برخیزد
حجاب ره تویی برخیز و در فتراک عشق آویز
که بی‌عشق آن حجاب تو ز ره دشوار برخیزد
عراقی، هر سحرگاهی بر آر از سوز دل آهی
ز خواب این دیدهٔ بختت مگر یکبار برخیزد
آن را که چو تو نگار باشد
با خویشتنش چه کار باشد؟
ناخوش نبود کسی که او را
یاری چو تو در کنار باشد
ناخوش چو منی بود که پیوست
دل خسته و جان فگار باشد
مزار ز من، اگر بنالم
ماتم‌زده سوکوار باشد
وان دیده که او ندید رویت
شاید اگر آشکار باشد
آن کس که جدا فتاد از تو
دور از تو همیشه زار باشد
بیچاره کسی که در دو عالم
جز تو دگریش یار باشد
خرم دل آن کسی که او را
اندوه تو غمگسار باشد
تا کی دلم، ای عزیز چون جان
بر خاک در تو خوار باشد؟
نامد گه آن که خسته‌ای را
بر درگه وصل بار باشد؟
تا چند دل عراقی آخر
در زحمت انتظار باشد؟
تا بر قرار حسنی دل بی‌قرار باشد
تا روی تو نبینم جان سوکوار باشد
تا پیش تو نمیرد جانم نگیرد آرام
تا بوی تو نیابد دل بی‌قرار باشد
جانا، ز عشق رویت جانم رسید بر لب
تا کی ز آرزویت بیچاره زار باشد؟
آن را مخواه بی‌دل کو بی‌تو جان نخواهد
آن را مدار دشمن کت دوستدار باشد
درمان اگر نداری، باری به درد یاد آر
کز دوست هرچه آید آن یادگار باشد
با درد خوش توان بود عمری به بوی درمان
با غم بسر توان برد گر غمگسار باشد
خواهی بساز کارم، خواهی بسوز جانم
با کار پادشاهان ما را چه کار باشد؟
از انتظار وصلت آمد به جان عراقی
تا کی غریب و خسته در انتظار باشد؟
دیدهٔ بختم، دریغا کور شد
دل نمرده، زنده اندر گور شد
دست گیر ای دوست این بخت مرا
تا نبیند دشمنم کو کور شد
بارگاه دل، که بودی جای تو
بنگر اکنون جای مار و مور شد
بی‌لب شیرینت عمرم تلخ گشت
شوربختی بین که: عیشم شور شد
دل قوی بودم به امید تو، لیک
دل ندادی، خسته زان بی‌نور شد
شور عشقت تا فتاد اندر جهان
چون دل من عالمی پر شور شد
عارت آمد از عراقی، لاجرم
بی‌تو، مسکین، بی‌نوا و عور شد
من مست می عشقم هشیار نخواهم شد
وز خواب خوش مستی بیدار نخواهم شد
امروز چنان مستم از بادهٔ دوشینه
تا روز قیامت هم هشیار نخواهم شد
تا هست ز نیک و بد در کیسهٔ من نقدی
در کوی جوانمردان عیار نخواهم شد
آن رفت که می‌رفتم در صومعه هر باری
جز بر در میخانه این بار نخواهم شد
از توبه و قرایی بیزار شدم، لیکن
از رندی و قلاشی بیزار نخواهم شد
از دوست به هر خشمی آزرده نخواهم گشت
وز یار به هر زخمی افگار نخواهم شد
چون یار من او باشد، بی‌یار نخواهم ماند
چون غم خورم او باشد غم‌خوار نخواهم شد
تا دلبرم او باشد دل بر دگری ننهم
تا غم خورم او باشد غمخوار نخواهم شد
چون ساختهٔ دردم در حلقه نیارامم
چون سوختهٔ عشقم در نار نخواهم شد
تا هست عراقی را در درگه او باری
بر درگه این و آن بسیار نخواهم شد
گر نظر کردم به روی ماه رخساری چه شد؟
ور شدم مست از شراب عشق یکباری چه شد؟
روی او دیدم سر زلفش چرا آشفته گشت ؟
گر نبیند بلبل شوریده، گلزاری چه شد؟
چشم او با جان من گر گفته رازی، گو، بگوی
حال بیماری اگر پرسید بیماری چه شد؟
دشمنم با دوستان گوید: فلانی عاشق است
عاشقم بر روی خوبان، عاشقم، آری چه شد؟
در سر سودای عشق خوبرویان شد دلم
وز چنان زلف ار ببستم نیز زناری چه شد؟
گر گذشتم بر در میخانه ناگاهی چه باک؟
گر به پیران سر شکستم توبه یکباری چه شد؟
چون شدم مست از شراب عشق، عقلم گو: برو
گر فرو شست آب حیوان نقش دیواری چه شد؟
گر میان عاشق و معشوق جرمی رفت رفت
تو نه معشوقی نه عاشق، مر تو را باری چه شد؟
زاهدی را کز می و معشوق رنگی نیست نیست
گر کند بر عاشقان هر لحظه انکاری چه شد؟
های و هوی عاشقان شد از زمین بر آسمان
نعرهٔ مستان اگر نشنید هشیاری چه شد؟
از خمستان نعرهٔ مستان به گوش من رسید
رفتم آنجا تا ببینم حال میخواری چه شد؟
دیدم اندر کنج میخانه عراقی را خراب
گفتم: ای مسکین، نگویی تا تو را باری چه شد؟"
eraghi,eraghi,eraghi,"
ناگه بت من مست به بازار برآمد
شور از سر بازار به یکبار برآمد
بس دل که به کوی غم او شاد فروشد
بس جان که ز عشق رخ او زار برآمد
در صومعه و بتکده عشقش گذری کرد
مؤمن ز دل و گبر، ز زنار برآمد
در کوی خرابات جمالش نظر افگند
شور و شغبی از در خمار برآمد
در وقت مناجات خیال رخش افروخت
فریاد و فغان از دل ابرار برآمد
یک جرعه ز جام لب او می‌زده‌ای یافت
سرمست و خرامان به سر دار برآمد
در سوخته‌ای آتش شمع رخش افتاد
از سوز دلش شعلهٔ انوار برآمد
باد در او بر سر آتش گذری کرد
از آتش سوزان گل بی خار برآمد
ناگاه ز رخسار شبی پرده برانداخت
صد مهر ز هر سو به شب تار برآمد
باد سحر از خاک درش کرد حکایت
صد نالهٔ زار از دل بیمار برآمد
کی بو که فروشد لب او بوسه به جانی؟
کز بوک و مگر جان خریدار برآمد
ناگه بت من مست به بازار برآمد
شور از سر بازار به یکبار برآمد
مانا به کرشمه سوی او باز نظر کرد
کین شور و شغب از سر بازار برآمد
با اهل خرابات ندانم چه سخن گفت؟
کاشوب و غریو از در خمار برآمد
در صومعه ناگاه رخش پرده برانداخت
فریاد و فغان از دل ابرار برآمد
آورد چو در کار لب و غمزه و رخسار
جان و دل و چشم همه از کار برآمد
تا جز رخ او هیچ کسی هیچ نبیند
در جمله صور آن بت عیار برآمد
هر بار به رنگی بت من روی نمودی
آن بار به رنگ همه اطوار برآمد
و آن شیفته کز زلف و قدش دار و رسن یافت
بگرفت رسن، خوش به سر دار برآمد
فی‌الجمله برآورد سر از جیب بزودی
هر دم به لباسی دگر آن یار برآمد
و آن سوخته کاتش همه تاب رخ او دید
زو دعوی «النار ولاالعار» برآمد
المنةلله که پس از منت بسیار
مقصود و مرادم ز لب یار برآمد
دور از لب و دندان عراقی همه کامم
زان دو لب شیرین شکر بار برآمد
غلام حلقه به گوش تو زار باز آمد
خوشی درو بنگر، کز ره دراز آمد
به لطف، کار دل مستمند خسته بساز
که خستگان را لطف تو در کار، ساز آمد
چه باشد ار بنوازی نیازمندی را؟
که با خیال رخت دم به دم به راز آمد
چه کرده‌ام که ز درگاه وصل جان افزا
نصیب خسته دلم هجر جانگداز آمد؟
بر آستان درت صدهزار دل دیدم
مگر که خاک سر کوت دلنواز آمد؟
غبار خاک درت بر سر کسی که نشست
ز سروران جهان گشت و سرفراز آمد
به هر طرف که شدم تا که شاد بنشینم
غم تو پیش دل من دو اسبه باز آمد
به روی خرم تو شادمان نشد افسوس!
دل عراقی از آن دم که عشقباز آمد
بیا، که بی‌رخ زیبات دل به جان آمد
بیا، که بی‌تو همه سود من زیان آمد
بیا، که بهر تو جان از جهان کرانه گرفت
بیا، که بی‌تو دلم جمله در میان آمد
بیا، که خانهٔ دل گرچه تنگ و تاریک است
دمی برای دل ما درون توان آمد
بیا، که غیر تو در چشم من نیامد هیچ
جز آب دیده که بر چشم من روان آمد
نگر هر آنچه که بر هیچکس نیامده بود
برین شکسته دلم از غم تو آن آمد
دل شکسته‌ام آن لحظه دل ز جان برداشت
که رسم جور و جفای تو در جهان آمد
ز جور یار چه نالم؟ که طالع دل من
چنان که بخت عراقی است همچنان آمد
ز اشتیاق تو، جانا، دلم به جان آمد
بیا، که با غم تو بر نمی‌توان آمد
بیا، که با لب تو ماجرا نکرده هنوز
به جای خرقه دل و دیده در میان آمد
به چشم مست تو گفتم: دلم به جان آید
لب تو گفتا: اینک دلت به جان آمد
بدید تا نظر از دور ناردان لبت
بسا که چشم مرا آب در دهان آمد
نیامد از دو جهان جز رخ تو در نظرم
از آنگهی که مرا چشم در جهان آمد
ز روشنایی روی تو در شب تاریک
نمی‌توان به سر کوی تو نهان آمد
آشکارا نهان کنم تا چند؟
دوست می‌دارمت به بانگ بلند
دلم از جان نخست دست بشست
بعد از آن دیده بر رخت افکند
عاشقان تو نیک معذورند
زانکه نبود کسی تو را مانند
دیده‌ای کو رخ تو دیده بود
خواه راحت رسان و خواه گزند
ای ملامت کنان مرا در عشق
گوش من نشنود ازین سان پند
گرچه من دور مانده‌ام ز برت
با خیال تو کرده‌ام پیوند
آن چنان در دلی که پنداری
ناظرم در تو دایم، ای دلبند
تو کجایی و ما کجا هیهات!
ای عراقی، خیال خیره مبند"
