author,b_name,p_name,text
eraghi,eraghi,eraghi,"
جانا، نظری، که دل فگار است
بخشای، که خسته نیک زار است
بشتاب، که جان به لب رسید است
دریاب کنون، که وقت کار است
رحم آر، که بی‌تو زندگانی
از مرگ بتر هزار بار است
دیری است که بر در قبول است
بیچاره دلم ، که نیک خوار است
نومید چگونه باز گردد؟
از درگهت، آن کامیدوار است
ناخورده دلم شراب وصلت
از دردی هجر در خمار است
مگذار به کام دشمن ، ای دوست
بیچاره مرا ، که دوستدار است
رسواش مکن به کام دشمن
کو خود ز رخ تو شرمسار است
خرم دل آن کسی، که او را
اندوه و غم تو غمگسار است
یادیش ازین و آن نیاید
آن را که، چو تو نگار، یار است
کار آن دارد، که بر در تو
هر لحظه و هر دمیش بار است
نی آنکه همیشه چون عراقی
بر خاک درت چو خاک خوار است
دل، چو در دام عشق منظور است
دیده را جرم نیست، معذور است
ناظرم در رخت به دیدهٔ دل
گرچه از چشم ظاهرم دور است
از شراب الست روز وصال
دل مستم هنوز مخمور است
دست ازین عاشقی نمی‌دارد
دایم از یار اگرچه مهجور است
حال آشفته بر رخش فاش است
شعله و نار پرتو نور است
حکم داری به هر چه فرمایی
که عراقی مطیع و مامور است
ساز طرب عشق که داند که چه ساز است؟
کز زخمهٔ آن نه فلک اندر تک و تاز است
آورد به یک زخمه، جهان را همه، در رقص
خود جان و جهان نغمهٔ آن پرده‌نواز است
عالم چو صدایی است ازین پرده، که داند
کین راه چه پرده است و درین پرده چه راز است؟
رازی است درین پرده، گر آن را بشناسی
دانی که حقیقت ز چه دربند مجاز است؟
معلوم کنی کز چه سبب خاطر محمود
پیوسته پریشان سر زلف ایاز است؟
محتاج نیاز دل عشاق چرا شد
حسن رخ خوبان، که همه مایهٔ ناز است؟
عشق است که هر دم به دگر رنگ برآید
ناز است بجایی و به یک جای نیاز است
در صورت عاشق چو درآید همه سوز است
در کسوت معشوق چو آید همه ساز است
زان شعله که از روی بتان حسن برافروخت
قسم دل عشاق همه سوز و گداز است
راهی است ره عشق، به غایت خوش و نزدیک
هر ره که جُز این است همه دور و دراز است
مستی، که خراب ره عشق است، درین ره
خواب خوش مستیش همه عین نماز است
در صومعه چون راه ندادند مرا دوش
رفتم به در میکده، دیدم که فراز است
از میکده آواز برآمد که: عراقی
درباز تو خود را، که در میکده باز است
در کوی خرابات، کسی را که نیاز است
هشیاری و مستیش همه عین نماز است
آنجا نپذیرند صلاح و ورع امروز
آنچ از تو پذیرند در آن کوی نیاز است
اسرار خرابات به جز مست نداند
هشیار چه داند که درین کوی چه راز است؟
تا مستی رندان خرابات بدیدم
دیدم به حقیقت که جزین کار مجاز است
خواهی که درون حرم عشق خرامی؟
در میکده بنشین که ره کعبه دراز است
هان! تا ننهی پای درین راه ببازی
زیرا که درین راه بسی شیب و فراز است
از میکده‌ها نالهٔ دلسوز برآمد
در زمزمهٔ عشق ندانم که چه ساز است؟
در زلف بتان تا چه فریب است؟که پیوست
محمود پریشان سر زلف ایاز است
زان شعله که از روی بتان حسن تو افروخت
جان همه مشتاقان در سوز و گداز است
چون بر در میخانه مرا بار ندادند
رفتم به در صومعه، دیدم که فراز است
آواز ز میخانه برآمد که: عراقی
در باز تو خود را که در میکده باز است
طرهٔ یار پریشان چه خوش است
قامت دوست خرامان چه خوش است
خط خوش بر لب جانان چه نکوست
سبزه و چشمهٔ حیوان چه خوش است
از می عشق دلی مست و خراب
همچو چشم خوش جانان چه خوش است
در خرابات خراب افتاده
عاشق بی سر و سامان چه خوش است
آن دل شیفتهٔ ما بنگر
در خم زلف پریشان چه خوش است
یوسف گم شدهٔ ما را بین
کاندر آن چاه زنخدان چه خوش است
لذت عشق بتم از من پرس
تو از آن بی‌خبری کان چه خوش است
تو چه دانی که شکر خندهٔ او
از دهان شکرستان چه خوش است؟
چه شناسی که می و نقل بهم
از لب آن بت خندان چه خوش است
گر ببینی که به وقت مستی
لب من بر لب جانان چه خوش است
یار ساقی و عراقی باقی
وه که این عیش بدینسان چه خوش است"
eraghi,eraghi,eraghi,"
در سرم عشق تو سودایی خوش است
در دلم شوقت تمنایی خوش است
ناله و فریاد من هر نیم‌شب
بر در وصلت تقاضایی خوش است
تا نپنداری که بی‌روی خوشت
در همه عالم مرا جایی خوش است
با سگان گشتن مرا هر شب به روز
بر سر کویت تماشایی خوش است
گرچه می‌کاهد غم تو جان من
یاد رویت راحت افزایی خوش است
در دلم بنگر، که از یاد رخت
بوستان و باغ و صحرایی خوش است
تا عراقی والهٔ روی تو شد
در میان خلق رسوایی خوش است
رخ نگار مرا هر زمان دگر رنگ است
به زیر هر خم زلفش هزار نیرنگ است
کرشمه‌ای بکند، صدهزار دل ببرد
ازین سبب دل عشاق در جهان تنگ است
اگر برفت دل از دست، گو: برو، که مرا
بجای دل سر زلف نگار در چنگ است
از آن گهی که خراباتیی دلم بربود
مرا هوای خرابات و باده و چنگ است
بدین صفت که منم، از شراب عشق خراب
مرا چه جای کرامات و نام یا ننگ است؟
بیار ساقی، از آن می، که ساغر او را
ز عکس چهرهٔ تو هر زمان دگر رنگ است
بریز خون عراقی و آشتی وا کن
که آشتی بهمه حال بهتر از جنگ است
شاد کن جان من، که غمگین است
رحم کن بر دلم، که مسکین است
روز اول که دیدمش گفتم:
آنکه روزم سیه کند این است
روی بنمای، تا نظاره کنم
کارزوی من از جهان این است
دل بیچاره را به وصل دمی
شادمان کن، که بی‌تو غمگین است
بی‌رخت دین من همه کفر است
با رخت کفر من همه دین است
گه گهی یاد کن به دشنامم
سخن تلخ از تو شیرین است
دل به تو دادم و ندانستم
که تو را کبر و ناز چندین است
بنوازی و پس بیازاری
آخر، ای دوست این چه آیین است؟
کینه بگذار و دلنوازی کن
که عراقی نه در خور کین است
مشو، مشو، ز من خسته‌دل جدا ای دوست
مکن، مکن، به کف اندُهم رها ای دوست
برس، که بی‌تو مرا جان به لب رسید، برس
بیا که بر تو فشانم روان، بیا ای دوست
بیا، که بی‌تو مرا برگ زندگانی نیست
بیا، که بی‌تو ندارم سر بقا ای دوست
اگر کسی به جهان در، کسی دگر دارد
من غریب ندارم مگر تو را ای دوست
چه کرده‌ام که مرا مبتلای غم کردی؟
چه اوفتاد که گشتی ز من جدا ای دوست؟
کدام دشمن بدگو میان ما افتاد؟
که اوفتاد جدایی میان ما ای دوست
بگفت دشمن بدگو ز دوستان مگسل
برغم دشمن شاد از درم درآ ای دوست
از آن نفس که جدا گشتی از من بی‌دل
فتاده‌ام به کف محنت و بلا ای دوست
ز دار ضرب توام سکه بر وجود زده
مرا بر آتش محنت میازما ای دوست
چو از زیان منت هیچگونه سودی نیست
مخواه بیش زیان من گدا ای دوست
ز لطف گرد دل بی‌غمان بسی گشتی
دمی به گرد دل پر غمان برآ ای دوست
ز شادی همه عالم شدست بیگانه
دلم که با غم تو گشت آشنا ای دوست
ز روی لطف و کرم شاد کن بروی خودم
که کرد بار غمت پشت من دوتا ای دوست
ز همرهی عراقی ز راه واماندم
ز لطف بر در خویشم رهی نما ای دوست
کی ببینم چهرهٔ زیبای دوست؟
کی ببوسم لعل شکرخای دوست؟
کی درآویزم به دام زلف یار؟
کی نهم یک لحظه سر بر پای دوست؟
کی برافشانم به روی دوست جان؟
کی بگیرم زلف مشک‌آسای دوست؟
این چنین پیدا، ز ما پنهان چراست؟
طلعت خوب جهان پیمای دوست
همچو چشم دوست بیمارم، کجاست
شکری زان لعل جان‌افزای دوست؟
در دل تنگم نمی‌گنجد جهان
خود نگنجد دشمن اندر جای دوست
دشمنم گوید که: ترک دوست گیر
من به رغم دشمنان جویای دوست
چون عراقی، واله و شیدا شدی
دشمن ار دیدی رخ زیبای دوست
یک لحظه دیدن رخ جانانم آرزوست
یکدم وصال آن مه خوبانم آرزوست
در خلوتی چنان، که نگنجد کسی در آن
یکبار خلوت خوش جانانم آرزوست
من رفته از میانه و او در کنار من
با آن نگار عیش بدینسانم آرزوست
جانا، ز آرزوی تو جانم به لب رسید
بنمای رخ، که قوت دل و جانم آرزوست
گر بوسه‌ای از آن لب شیرین طلب کنم
طیره مشو، که چشمهٔ حیوانم آرزوست
یک بار بوسه‌ای ز لب تو ربوده‌ام
یک بار دیگر آن شکرستانم آرزوست
ور لحظه‌ای به کوی تو ناگاه بگذرم
عیبم مکن، که روضهٔ رضوانم آرزوست
وز روی آن که رونق خوبان ز روی توست
دایم نظارهٔ رخ خوبانم آرزوست
بر بوی آن که بوی تو دارد نسیم گل
پیوسته بوی باغ و گلستانم آرزوست
سودای تو خوش است و وصال تو خوشتر است
خوشتر ازین و آن چه بود؟ آنم آرزوست
ایمان و کفر من همه رخسار و زلف توست
در بند کفر مانده و ایمانم آرزوست
درد دل عراقی و درمان من تویی
از درد بس ملولم و درمانم آرزوست"
eraghi,eraghi,eraghi,"
جز دیدن روی تو مرا رای دگر نیست
جز وصل توام هیچ تمنای دگر نیست
این چشم جهان بین مرا در همه عالم
جز بر سر کوی تو تماشای دگر نیست
وین جان من سوخته را جز سر زلفت
اندر همه گیتی سر سودای دگر نیست
یک لحظه غمت از دل من می‌نشود دور
گویی که غمت را جز ازین رای دگر نیست
یک بوسه ربودم ز لبت، دل دگری خواست
فرمود فراق تو که: فرمای، دگر نیست
هستند تو را جمله جهان واله و شیدا
لیکن چو منت واله و شیدای دگر نیست
عشاق تو گرچه همه شیرین سخنانند
لیکن چو عراقیت شکرخای دگر نیست
هر دلی کو به عشق مایل نیست
حجرهٔ دیو خوان، که آن دل نیست
زاغ گو، بی‌خبر بمیر از عشق
که ز گل عندلیب غافل نیست
دل بی‌عشق چشم بی‌نور است
خود بدین حاجت دلایل نیست
بیدلان را جز آستانهٔ عشق
در ره کوی دوست منزل نیست
هر که مجنون نشد درین سودا
ای عراقی، بگو که: عاقل نیست
ساقی، ار جام می، دمادم نیست
جان فدای تو، دردیی کم نیست
من که در میکده کم از خاکم
جرعه‌ای هم مرا مسلم نیست
جرعه‌ای ده، مرا ز غم برهان
که دلم بی‌شراب خرم نیست
از خودی خودم خلاصی ده
کز خودم زخم هست مرهم نیست
چون حجاب من است هستی من
گر نباشد، مباش، گو: غم نیست
ز آرزوی دمی دلم خون شد
که شوم یک نفس درین دم نیست
بهر دل درهم و پریشانم
چه کنم؟ کار دل فراهم نیست
خوشدلی در جهان نمی‌یابم
خود خوشی در نهاد عالم نیست
در جهان گر خوشی کم است مرا
خوش از آنم که ناخوشی هم نیست
کشت امید را، که خشک بماند
بهتر از آب چشم من نم نیست
ساقیا، یک دمم حریفی کن
کین دمم جز تو هیچ همدم نیست
ساغری ده، مرا ز من برهان
که عراقی حریف و محرم نیست
عشق سیمرغ است، کو را دام نیست
در دو عالم زو نشان و نام نیست
پی به کوی او همانا کس نبرد
کاندر آن صحرا نشان گام نیست
در بهشت وصل جان‌افزای او
جز لب او کس رحیق آشام نیست
جمله عالم جرعه چین جام اوست
گرچه عالم خود برون از جام نیست
ناگه از رخ گر براندازد نقاب
سر به سر عالم شود ناکام، نیست
صبح و شامم طره و رخسار اوست
گرچه آنجا کوست صبح و شام نیست
ای صبا، گر بگذری در کوی او
نزد او ما را جزین پیغام نیست:
کای دلارامی که جان ما تویی
بی تو ما را یک نفس آرام نیست
هرکسی را هست کامی در جهان
جز لبت ما را مراد و کام نیست
هر کسی را نام معشوقی که هست
می‌برد، معشوق ما را نام نیست
تا لب و چشم تو ما را مست کرد
نقل ما جز شکر و بادام نیست
تا دل ما در سر زلف تو شد
کار ما جز با کمند و دام نیست
نیک بختی را که در هر دو جهان
دوستی چون توست دشمن کام نیست
با عراقی دوستی آغاز کن
گر چه او در خورد این انعام نیست
دل، که دایم عشق می‌ورزید رفت
گفتمش: جانا مرو، نشنید رفت
هر کجا بوی دلارامی شنید
یا رخ خوب نگاری دید رفت
هرکجا شکرلبی دشنام داد
یا نگاری زیر لب خندید رفت
در سر زلف بتان شد عاقبت
در کنار مهوشی غلتید رفت
دل چو آرام دل خود بازیافت
یک نفس با من نیارامید رفت
چون لب و دندان دلدارم بدید
در سر آن لعل و مروارید رفت
دل ز جان و تن کنون دل برگرفت
از بد و نیک جهان ببرید رفت
عشق می‌ورزید دایم، لاجرم
در سر چیزی که می‌ورزید رفت
باز کی یابم دل گم گشته را؟
دل که در زلف بتان پیچید رفت
بر سر جان و جهان چندین ملرز
آنکه شایستی بدو لرزید رفت
ای عراقی، چند زین فریاد و سوز؟
دلبرت یاری دگر بگزید رفت
آه، به یک‌بارگی یار کم ما گرفت!
چون دل ما تنگ دید خانه دگر جا گرفت
بر دل ما گه گهی، داشت خیالی گذر
نیز خیالش کنون ترک دل ما گرفت
دل به غمش بود شاد، رفت غمش هم ز دل
غم چه کند در دلی کان همه سودا گرفت؟
دیدهٔ گریان مگر بر جگر آبی زند؟
کاتش سودای او در دل شیدا گرفت
خوش سخنی داشتم، با دل پردرد خویش
لشکر هجران بتاخت در سر من تا گرفت
دین و دل و هوش من هر سه به تاراج برد
جان و تن و هرچه بود جمله به یغما گرفت
هجر مگر در جهان هیچ کسی را نیافت
کز همه وامانده‌ای، هیچکسی را گرفت
هیچ کسی در جهان یار عراقی نشد
لاجرمش عشق یار، بی‌کس و تنها گرفت"
eraghi,eraghi,eraghi,"
باز هجر یار دامانم گرفت
باز دست غم گریبانم گرفت
چنگ در دامان وصلش می‌زدم
هجرش اندر تاخت، دامانم گرفت
جان ز تن از غصه بیرون خواست شد
محنت آمد، دامن جانم گرفت
در جهان یک دم نبودم شادمان
زان زمان کاندوه جانانم گرفت
آتش سوداش ناگه شعله زد
در دل غمگین حیرانم گرفت
تا چه بد کردم؟ که بد شد حال من
هرچه کردم عاقبت آنم گرفت
مرا گر یار بنوازد، زهی دولت زهی دولت
وگر درمان من سازد، زهی دولت زهی دولت
ور از لطف و کرم یک ره درآید از درم ناگه
ز رخ برقع براندازد، زهی دولت زهی دولت
دل زار من پر غم نبوده یک نفس خرم
گر از محنت بپردازد، زهی دولت زهی دولت
فراق یار بی‌رحمت مرا در بوتهٔ زحمت
گر از این بیش نگدازد، زهی دولت زهی دولت
چنینم زار نگذارد ، به تیماریم یاد آرد
ورم از لطف بنوازد، زهی دولت زهی دولت
ور از کوی فراموشان فراقش رخت بربندد
وصالش رخت در بازد، زهی دولت زهی دولت
و گر با لطف خود گوید: عراقی را بده کامی
که جان خسته دربازد، زهی دولت زهی دولت
کی از تو جان غمگینی شود شاد؟
کی آخر از فراموشی کنی یاد؟
نپندارم که هجرانت گذارد
که از وصل تو دلتنگی شود شاد
چنین دانم که حسنت کم نگردد
اگر کمتر کند ناز تو بیداد
ز وصل خود بده کام دل من
که از بیداد هجر آمد به فریاد
بیخشای از کرم بر خاکساری
که در روی تو عمرش رفت بر باد
نظر کن بر دل امیدواری
که بر درگاه تو نومید افتاد
بجز درگاه تو هر در که زد دل
عراقی را ازان در هیچ نگشاد
هر که را جام می به دست افتاد
رند و قلاش و می‌پرست افتاد
دل و دین و خرد زدست بداد
هر که را جرعه‌ای به دست افتاد
چشم میگون یار هر که بدید
ناچشیده شراب، مست افتاد
وانکه دل بست در سر زلفش
ماهی‌آسا، میان شست افتاد
لشکر عشق باز بیرون تاخت
قلب عشاق را شکست افتاد
عاشقی کز سر جهان برخاست
زود با دوستش نشست افتاد
هر که پا بر سر جهان ننهاد
همت او عظیم پست افتاد
سر جان و جهان ندارد آنک:
در سرش بادهٔ الست افتاد
وآنکه از دست خود خلاص نیافت
در ره عشق پای‌بست افتاد
هان، عراقی، ببر ز هستی خویش
نیستی بهره‌ات ز هست افتاد
باز دل از در تو دور افتاد
در کف صد بلا صبور افتاد
نیک نزدیک بود بر در تو
تا چه بد کرد کز تو دور افتاد
یا حسد برد دشمن بد دل
یا مرا دوستی غیور افتاد
ماتم خویشتن همی دارد
چون مصیبت زده، ز سور افتاد
چون ز خاک در تو سرمه نیافت
دیده‌ام بی‌ضیا و نور افتاد
جان که یک ذره انده تو بیافت
در طربخانهٔ سرور افتاد
از بهشت رخ تو بی‌خبر است
تن که در آرزوی حور افتاد
چون عراقی نیافت راه به تو
گمرهی گشت و در غرور افتاد
عشق شوری در نهاد ما نهاد
جان ما در بوتهٔ سودا نهاد
گفتگویی در زبان ما فکند
جستجویی در درون ما نهاد
داستان دلبران آغاز کرد
آرزویی در دل شیدا نهاد
رمزی از اسرار باده کشف کرد
راز مستان جمله بر صحرا نهاد
قصهٔ خوبان به نوعی باز گفت
کاتشی در پیر و در برنا نهاد
از خمستان جرعه‌ای بر خاک ریخت
جنبشی در آدم و حوا نهاد
عقل مجنون در کف لیلی سپرد
جان وامق در لب عذرا نهاد
دم به دم در هر لباسی رخ نمود
لحظه لحظه جای دیگر پا نهاد
چون نبود او را معین خانه‌ای
هر کجا جا دید، رخت آنجا نهاد
بر مثال خویشتن حرفی نوشت
نام آن حرف آدم و حوا نهاد
حسن را بر دیدهٔ خود جلوه داد
منتی بر عاشق شیدا نهاد
هم به چشم خود جمال خود بدید
تهمتی بر چشم نابینا نهاد
یک کرشمه کرد با خود، آنچنانک:
فتنه‌ای در پیر و در برنا نهاد
کام فرهاد و مراد ما همه
در لب شیرین شکرخا نهاد
بهر آشوب دل سوداییان
خال فتنه بر رخ زیبا نهاد
وز پی برک و نوای بلبلان
رنگ و بویی در گل رعنا نهاد
تا تماشای وصال خود کند
نور خود در دیدهٔ بینا نهاد
تا کمال علم او ظاهر شود
این همه اسرار بر صحرا نهاد
شور و غوغایی برآمد از جهان
حسن او چون دست در یغما نهاد
چون در آن غوغا عراقی را بدید
نام او سر دفتر غوغا نهاد"
