author,b_name,p_num,poems
ghaani,mosammatgh,6,"بنفشه رسته از زمین به طرف جویبارها
و یا گسسته حور عین ز زلف خویش تارها
ز سنگ اگر ندیده‌ای چسان جهد شرارها
به برگ‌های لاله بین میان لاله‌زارها
ندانما ز کودکی شکوفه از چه پیر شد
نخورده‌ شیر عارضش چرا به رنگ شیر شد
گمان برم که همچو من به دام غم اسیر شد
ز پا فکنده دلبرش چه خوب دستگیر شد
درین بهار هرکسی هوای راغ داردا
به یاد باغ طلعتی خیال باغ داردا
به تیره شب ز جام می به کف چراغ داردا
همین دل منست و بس که درد و داغ داردا
بهار را چه می کنم چو شد ز بر بهار من
کناره کردم از جهان چو او شد از کنار من
خوشا و خرم آن دمی که بود یار یار من
دو زلف مشکبار او به چشم اشکبار من
غزال ‌مشک‌موی من ز من خطا چه دیده‌ای
که همچو آهوان چین از آن خطا رمیده‌ای
بنفشه‌بوی من چرا به حجره آرمیده‌ای
نشاط سینه برده‌ای بساط کینه چیده‌ای
به صلح درکنارم آ، ز دشمنی کناره کن
دلت ره ار نمی‌دهد ز دوست استشاره کن
و یاچو سُبحه رشته‌ای ز زلف خویش‌ پاره کن
بر او ببند صدگره وزان پس استخاره کن
نه دلبری که بر رخش به یاد او نظرکنم
نه محرمی که پیش او حدیث عشق سر کنم
نه همدمی که یک دمش ز حال خود خبر کنم
نه بادهٔ محبتی کزو دماغ تر کنم
کسی نپرسدم خبر که کیستم چکاره‌ام
نه مفتیم نه محتسب نه رند باده خواره‌ام
نه خادم مساجدم نه مؤْذن مناره‌ام
نه کدخدای جوشقان نه عامل زواره‌ام
بهشت را چه می کنم بتا بهشت من تویی
بهار و باغ من تویی ریاض و کشت من تویی
بکن هر آنچه می کنی که‌ سرنوشت من تویی
بدل نه غایبی ز من که در سرشت من تویی
دمن ز خندهٔ لبت عقیق‌زا، یمن شود
یمن ز سبزهٔ خطت به خرمی چمن شود
چمن ز جلوهٔ رخت پر از گل و سمن شود
سمن چو بنگرد رخت به جان و دل شمن شود
به پیش شکرین لبت چه دم زند طبرزدا
که با لبت طبرزدا به حنظلی نیرزدا
خیال عشق روی تو اگر زمین بورزدا
ز اضطراب عشق تو چو آسمان بلرزدا
بت دو هفت سال من مرا می دو ساله ده
ز چشم خویش می‌فشان ز لعل خود پیاله ده
نگار لاله چهر من میی به رنگ لاله ده
ز بهر نقل بوسه‌ای مرا به لب حواله ده
بهل کتاب را بهم که مرد درس نیستم
نهال را چه می کنم که ز اهل غرس نیستم
شرابم آشکار ده که مرد ترس نیستم
به‌حفظ کشت عمرخود کم از مترس‌ نیستم
من ار شراب ‌می‌خورم به‌ بانگ کوس می‌خورم
به بارگاه تهمتن به بزم طوس‌ می‌خورم
پیاله‌های دَه منی علی رؤوس می‌خورم
شراب ‌گبر می‌چشَم می مجوس می‌خورم
الا چه سال‌ها که من می و ندیم داشتم
چو سال تازه می‌شدی می قدیم داشتم
پیاله‌ها و جام‌ها ز زرّ و سیم داشتم
دل جواد پر هنر کف کریم داشتم
کنون هم ار چه مفلسم ز دل نفس نمی‌کشم
به هیچ روی منّتی ز هیچ کس نمی‌کشم
فغان ز جور نیستی به دادرس نمی‌کشم
کشیدم ار چه پیش ازین ازین سپس نمی‌کشم
کریمه‌ای که از کرم سحاب زرفشان بود
صفیه‌ای که از صفا بهشت جاودان بود
عفاف ‌اوست کز ازل حجاب ‌جسم و جان بود
فرشتهٔ زمین بود ستارهٔ زمان بود
سپهر عصمت و حیا که شاه اوست ماه او
شهی که هست روز و شب زمانه در پناه او
سپهر در قبای او ستاره در کلاه او
الا نزاده مادری شهی قرین شاه او
یگانه‌ای که از شرف دو عالمند چاکرش
ز کاینات منتخب سه روح و چار گوهرش
به پنج حس و شش جهت نثار هفت اخترش
به هشت خلد و نه فلک فکنده سایه معجرش‌
میان بدر و چهر او بسی بود مباینه
از آنکه بدر هر کسی ببیندش معاینه
ولیک بدر چهر او گمان برم هر آینه
که عکس هم نیفکند چو نقش جان در آینه
به حکم شرع احمدی رواست اجتناب او
وگرنه بهر ستر رخ چه لازم احتجاب او
حیای او حجاب او عفاف او نقاب او
وگرنه شرم او بدی حجاب آفتاب او
زهی فلک به بندگی ستاده پیش روی تو
بهشت عدن آیتی ز خلق مشکبوی تو
تو عقل عالمی از آن کسی ندیده روی تو
نهان ز چشم و در میان همیشه گفت‌وگوی تو
خصایل جمیل تو به دهر هرکه بنگرد
وجود کاینات را دگر به هیچ نشمرد
چو ذره آفتاب را به چشم درنیاورد
به نعمت وجود تو ز هست و نیست بگذرد
ز بهر آنکه هر نفس ترا به جان ثنا کنم
برای طول عمر خود به خویشتن دعا کنم
حیات جاودانه را تمنی از خدا کنم
که تا ترا به جان و دل ثنا به عمرها کنم
چه منتم ز مردمان که اصل مردمی تویی
چه صرفه‌ام ز این و آن که صرف آدمی تویی
جهان پر ملال را بهشت خرمی تویی
به جان غم رسیدگان بهار بی‌غمی تویی
مگر باز بر فروخت گل از هر کنار نار
که هردم ز سوز دل بگرید هزار زار
نسیمی که در چمن شدی رهسپار پار
هم امسال یافتست بر جویبار بار
ز فراشی صبا ره باغ رفته بین
چو روی سمنبران سمن‌ها شکفته بین
گل نو شکفته را مه نوگرفته بین
پس از هفتهٔ دگرش چو ماهی دو هفته بین
چو پیچنده اژدریست گریان زکوه سیل
ز بالا سوی نشیب دو صد میل کرده میل
به ظاره‌اش ز شهر دوان خلق خیل خیل
زبان پر ز های و هوی روان پر ز وای و ویل
چو رعد از میان ابر دمادم بغردا
دل و زهرهٔ هزبر ز سهمش بدردا
به شمشیر صاعقه رگ که ببرّدا
سپس چون شراره خون از آن رگ بپردا
به طفل شکوفه بین که بر نامده ز شخ
دمد مویش از عذار به رنگ سپید نخ
چو پیران به کودکی سپیدش‌ شود ز نخ
وز آن موی همچو برف دلش بفسرد چو یخ
ز مه طلعتان شوخ ز‌ گلچهرگان شنگ
ز هرسو به طرف دشت گروهی زده کرنگ
به سر شور نای و به دل شور جام و چنگ
نه در فکر اسم و رسم نه در بند نام و ننگ
کنون از شکوفه‌ام شک افتاده در ضمیر
که گر شیرخواره‌است به صورت چراست پیر
و گر شیرخواره نیست چو طفلان شیرگیر
دمادم چرا خورد ز پستان ابر شیر
بده باده کز بهار جهان گلستان شده
گلستان ز سرخ گل همه ملستان شده
یکی بین به شاخ سرو که صلصلستان شده
نه صلصلستان شده که غلغلستان شده
چو آبستنان کند همی ابر ناله‌ها
که تا خرد بچگان بزاید ز ژاله‌ها
پس آن ژاله‌ها چکد بر آن سرخ لاله‌ها
چو در دانه‌های خرد به لعلعین پیاله‌ها
الا یا پریوشا الا یا سمنبرا
سمن سرزد از چمن چه خسبی به بسترا
به نظارهٔ بهار برون آ ز منظرا
همه راغ مشکبوست ز مشکو درآ درا
شبستان چه می کنی به بستان خرام کن
به گل تهنیت فرست به گلبن سلام کن
به گل از زبان مل پس آنگه پیام کن
که زخم فراق را به وصل التیام کن
همیدون من و ترا فزونتر شدست داغ
من اینجا اسیر خم تو آنجا مقیم باغ
مگر بهر چاره را کنی حیله‌ای چو زاغ
که مستان شهر را به هر جا کنی سراغ
ببوی از ره مشام به رنگ از ره بصر
به مغز و دماغشان چو دانش کنی مقر
که منهم ز کامشان دوم زود در جگر
و ز آنجا دوان دوان درآیم به مغز سر
الا ای که قوت تو شب و روز هست می
گل آمد به شاخ هان چه خسبی به کاخ هی
به سالوس و زرق و مکر مکن عمر خویش‌ طی
بزن جام یک ‌منی به آواز چنگ و نی
پس آنگه نظاره کن ز اعجاز ذوالمنن
پر از چشم شرزه شیر ز لاله همه دمن
پر از گوش زنده پیل ز زنبق همه چمن
هم از سرخ رنگ آن دمن تالی یمن
هلا ابر فرودین شب و روز دمبدم
بنشکیبد از عطا نیاساید از کرم
ببارد همی گهر بپاشد همی درم
چنان چون به‌ صبح عید ملک‌زادهٔ عجم
فلک فر علیقلی که گیتی به کام اوست
خداوند اختران کهین‌تر غلام اوست
بهر نامه نامها همه زیر نام اوست
زمین شرق تا به غرب پر از احتشام اوست
بکین‌توزی آسمان بدیو افکنی شهاب
برخشندگی سهیل ببخشندگی سحاب
گه حزم با درنگ گه عزم با شتاب
کرم هاش بی‌شمر هنرهاش بی‌حساب
بر حکم نافذش اگر چرخ دم زند
سرانجام دست‌ غم بسر از ندم زند
همان پیک و هم کیست که با او قدم زند
نزیبد حدوث را که لاف از قدم زند
چه صدیق متقی چه زندیق متهم
چه خوانندهٔ صمد چه خواهندهٔ صنم
بهر یک کند عطا بهر یک دهد درم
بلی نور آفتاب به هنگام صبحدم
ز سر تا قدم چو عقل کمال مجردست
جمال مجسمست جلال مجردست
عطای مصورست نوال مجردست
چو تسنیم و سلسبیل زلال مجردست
به‌ هر علم و هر هنر به هر فن و هر مقال
کند طی هر سخن کند حل هر سوال
گرفته‌ست و یافته به تایید ذوالجلال
ریاضی ازو رواج طبیعی ازو کمال
بیان بدیع او معانی چو سرکند
سخن گر مطولست چنان مختصرکند
که هرکس که بشنود تواند ز بر کند
همان حل مشکلات در اول نظرکند
به هر علم بی‌بدل به هر کار بی‌بدیل
بر دانشش عقول چو نزد علی عقیل
نه در زمرهٔ عدول توان جستنش عدیل
نه در فرقهٔ قبول تنی بوده زی قبیل
زهی ای به ملک فضل خداوند راستین
سپهرت بر آستان محیطت در آستین
امیران شه نشان به خاک تو ره‌نشین
مهانت به هر زمان ثناگو به هر زمین
تویی دستگیر خلق به هنگام پای لغز
تنت همچو جان پاک سراپا لطیف و نغز
همه جان خلق پوست همه پیکر تو مغز
حسد در دل عدوت چو چرک‌اندرورن چغز
چو هنگام کارزار به چهر افکنی گره
چو گیسوی گلرخان بپوشی به تن زره
چو ابروی مهوشان کمان را کنی بزه
همی چرخ گویدت که احسنت باد و زه
بدانگه که از زمین همی خون بجوشدا
تن چرخ را غبار به اکسون بپوشدا
ز تفّ سنان و تیغ به یم نم بخوشدا
ستاره به زیرگرد دمادم بکوشدا
زمین زیر پای اسب چو گردون بجنبدا
تکاور به میخ نعل زمین را بسنبدا
شخ و کوه را به سُم چو رنده برنددا
مخالف بگریدا موالف بخنددا
چو ساز جدل کنند قوی بال و برزها
کتفها ورم کند ز آسیب گرزها
بیاماسد از هراس به پهلو سپرزها
چو اطراف مرزها چو اکناف کرزها
تو چون با کمان و گرز برون آیی از کمین
مه نو درون چنگ زمانه به زیر زین
همی چون ستارگان عرق ریزی از جبین
به چرخ آفتاب و ماه نمایندت آفرین
چو روز و شب جهان که‌‌گردند بیش وکم
کنی جیش خصم راکم و بیش دمبدم
دو را گاه یکی کنی بدان تیر راست چم
سه را گاه شش کنی بدان تیغ پشت خم
از آنجاکه هست رسم به جبر و مقابله
که گر جذر با عدد نماید معادله
عدد را کنند بخش بَرو بی‌ مساهله
چو تیر دوشاخ تو دو جذرند یکدله
الا تا بروی بحر نشاید کشید پل
الا تا به کتف باد نشاید نهاد غل
الا تا بهر بهار برآید ز خاک گل
الا تا درون خم شود خون تاک مل
نشستن‌گهت مدام دلفروز قصر باد
کمالات بی‌شمر به ذات تو حصر باد
به هر کار ناصرت شهنشاه عصر باد
ز اقبال ناصری نصیب تو نصر باد
چو قاآنیت به بزم ثناگو هزار باد
گهرهای نظمشان همه آبدار باد
ز جودت به جیبشان گهرها نثار باد
چو تیغ تو جمله را گهر درکنار باد
جهان فرتوت باز جوانی از سر گرفت
به سر ز یاقوت سرخ شقایق افسر گرفت
چو تیره زاغی سحاب بر آسمان پر گرفت
ز چرخ اختر ربود ز نجم زیور گرفت
به بوستان سرخ گل چرا همی لب گزد
نهان شود زیر برگ چو باد بر وی وزد
چو دخت دوشیزه‌ای که زیر چادر خزد
ز خوف نامحرمی که خواهدش لب مزد
صبا رخ ارغوان به شوخی از بس مکد
چو دانه‌های عقیق ز عارضش خون چکد
وزان ستم سرخ گل ز خشم چندان ژکد
که پوست در پیکرش چو نار می‌بِتْرَکَد
طبق طبق سیم و زر به فرق عبهر چراست
به سیمگون پنجه‌اش پیالهٔ زر چراست
به جام سیمابیش شراب اصفر چراست
شرابش آمیخته به مشک و عنبر چراست
نشسته لاله خموش چو شاهدی پر دلال
ز بس که خوردست می به طرف باغ و تلال
رخانش گشتست آل زبانش گشتست لال
به چهر گلنارگون نهاده از مشک خال
سمن به باغ اندرون چو بر فلک مشتری‌ست
چنان بود تابناک که زهره‌اش مشتری‌ست
چو برگشاید دهن به شکل انگشتری‌ست
بهار صنعت‌نما چو تاجر ششتری‌ست
شکوفه طفلی‌ست خُرد تنش به نرمی حریر
رخش‌ به رنگ سهیل لبش به بوی عبیر
ندانم از رنج دهر به کودکی گشته پیر
و یا دوید از دلش به عارضش رنگ شیر
هلا بیابان عمر چرا به غم طی کنیم
میی گران‌سنگ ده که اسب غم پی کنیم
بیا غمان را علاج به ناله نی کنیم
چو لاله بر طرف باغ پیاله پر می کنیم
ز اصل صلصال خویش به پای او ریخت خاک
از آن میی کآدمش نشاند در خُلد تاک
به سالیان تافتند بر او سهیل و سماک
به ریشه‌اش آب داد ز جوهر جان پاک
ز صنع پروردگار چو در مدور همه
ز قدرت کردگار چو خور منور همه
چو شعر من آبدار چو گل معطر همه
چو دل گهرهای چند نهفته در بر همه
علیقلی میرزا امیر شهزادگان
یمین فرماندهان امین آزادگان
مجیر دل‌خستگان مغیث افتادگان
دلیر شمشیرزن چو گیو کشوادگان
سحاب جود و سخا محیط علم و عمل
سپهر مجد و بها غیاث ملک و ملل
جهان عز و علا پناه دین و دول
مدار خوف و رجا شفیع جرم و زلل
چو رخ نماید قمر چو کفش آید سحاب
چو کینه توزد سپهر چو دیو سوزد شهاب
چو وقعه جوید هِژَبْر چو حمله آرد عقاب
به حِلم وافِر نصیب به علم کامل نصاب
زهی ملکزاده‌ای که زیب دنیا تویی
بهشت اجلال را درخت طوبی تویی
سپهر اقبال را سهیل و شعری تویی
زمانه را از نخست مهین تمنی تویی
به وقعه ضِیغَم‌کُشی به‌ پهنه پیل‌افکنی
به قوت اژدردَری به حمله شیراوژَنی
به بزم دریادلی به رزم رویین‌تنی
زمانهٔ قاهری ستارهٔ رو‌شنی
نگردی از جود سیر بدین سخا ابر نیست
نترسی از اژدها بدین ‌جگر بَبْر نیست
به قدر یک ذره‌ات گه سخا صبر نیست
اگرچه بر تو ز کس به هیچ رو جبر نیست
چو در مدیحت مرا زبان گفتار نیست
به جز دعایت مرا ازین سپس‌ کار نیست
بلی شدن بر سپهر پلنگ را یار نیست
پلنگ را گو مپوی سپهر کهسار نیست
هماره تا خور ز حوت چَمَد به برج بَره
همیشه تا آسمان بود به شکل کُره
هماره تا خط راست نمی‌شود دایره
به جان خصم تو باد زنار غم نایره
باز برآمد به کوه رایت ابر بهار
سیل فرو ریخت سنگ از زبر کوهسار
باز به جوش آمدند مرغان از هر کنار
فاخته و بوالملیح‌ صلصل و کبک و هزار
هست بنفشه مگر قاصد اردیبهشت
کز همه گلها دمد بیشتر از طرف‌ کشت
وز نفسش جویبار گشته چو باغ بهشت
گویی با غالیه بر رخش ایزد نوشت
دیدهٔ نرگس به باغ باز پر از خواب شد
طرهٔ سنبل به راغ باز پر از تاب شد
آب فسرده چو سیم باز چو سیماب شد
باد بهاری بجست زهرهٔ وی آب شد
غبغب این می‌مکد عارض آن می‌مزد
نرمک نرمک نسیم زیر گلان می‌خزد
گه به چمن می‌چمد گه به سمن می‌وزد
گیسوی این می کشد گردن آن می گزد
لاله درآمد به باغ با رخ افروخته
بهرش خیاط طبع سرخ قبا دوخته
سرخ‌قبایش به‌بر یک‌دو سه‌جا سوخته
باکه ز دلدادگان عاشقی آموخته
طفل چو زاید ز مام گریه کند زودسر
بهر تقاضای شیر وز پی قوت جگر
وز پس‌ گریه کند خنده به چندی دگر
طفل شکوفه چرا خندد زان پیشتر
باغ چو از ایزدی جامه مُخلّع شود
ظاهر از انواع گل شکل مضلع شود
یکی مخمس شود یکی مربع شود
یکی مسدس شود یکی مسبع شود
بر سر سیمینه طشت طاسک زر بر نهاد
نرگسک آن طشت سیم باز به سر برنهاد
بر پر زرین او ژاله گهر بر نهاد
در وسط طاس زر زرین پر بر نهاد
چون ز تن‌ سرخ بید ‌گشت عیان سرخ باد
از فزعش ارغوان در خفقان اوفتاد
نامیه همچون طبیب دست به نبضش نهاد
پس بن‌ بازوش بست ز اکحل او خون‌ گشاد
کنیزکی چینی است به باغ در نسترن
سپید و نغز و لطیف چو خواهرش یاسمن
ستارگانند خرد بهم شده مقترن
و یا گسسته ز مهر سپهر عقد پرن
د‌ایرهٔ سرخ گل گشته مضرّس‌ چراست
بر تنش این ایزدی جامهٔ اطلس چراست
دیبه او بی‌نورد این همه املس چراست
بوته صفت در میانش‌ زرّ مکلّس چراست
بلبلکان زوج زوج زیر و بم انگیخته
صلصلکان فوج فوج خوش بهم آمیخته
پشت به غم داده خلق در نغم آویخته
تیغ تعنت قهر یر الم آهیخته
بلبل بر شاخ گل نغمه سراید همی
نغمه‌اش از لوح دل زنگ زداید همی
شاهد گلزار را خوش بستاید همی
نی غلطم کاو چو من مدح نماید همی
فاخر فخری لقب مفخر اولاد جم
علیقلی میرزا زادهٔ شاه عجم
کلیم‌ کافی کلام کریم وافی کرم
به بزم میر اجل به رزم شیر اجم
چون ز طبیعی سخن یا ز الهی کند
آنکه به ملک هنر دعوی شاهی کند
چون ز اوامر حدیث یا ز نواهی کند
حلّ مسائل همه نیک کماهی کند
جداول زیجها نگاشته در نظر
شکل مجسطی تمام کشیده اندر بصر
زاویه و جیب و ظلّ جمله بداند ز بر
نسبت قطر و محیط صورت قوس و وتر
بوالفرج و بوالعلا بوالحسن‌ و نفطویه
اصمعی‌ و واقدی مازنی‌ و سیبویه
ازهری و یافعی، جاحظ و بن خالویه
کل یثنی علیه کل یاوی الیه
که‌ چند هستش دیار که چیستش ‌‌طول و عرض
به علم جغرافیا یعنی در وصف ارض
هم از نظام دول ز لشکر و باج و قرض
هم از رسوم ملل هم از تکالیف فرض
بی‌مدد دوربین دیده درنگ و شتاب
یازده سیاره را گرد کرهٔ آفتاب
قلی‌ و قسنی‌ ازو نکته بَر و نکته‌یاب
دورهٔ اقمار را نیک بداند حساب
مسائل فلسفی ز بر بداند همی
مطالب صرف و نحو ز بر بخواند همی
شدن به چرخ برین‌ می‌بتواند همی
ز علمهای غریب سخن براند همی
ار ز علا قدر تو به چرخ پهلو زده
طعنه ز خلق جمیل به باغ مینو زده
پیر خرد پیش تو چو طفل زانو زده
گاه غضب با پلنگ پنجه به نیرو زده
در صف ناورد تو بیژن و گودرز چیست
دیو و تهمتن کدام طوس و فرامرز چیست
جنبش بال پشه پیش زمین لرز چیست
کشور بخشی و گنج باغ چه و مرز چیست
به‌ جود صد حاتمی به حلم صد احنفی‌
به ‌فضل‌ صد جعفری به‌ علم‌ صد آصفی
جلیل چون آدمی جمیل چون یوسفی
در صف شهزادگان تو ز هنر سر صفی
عقلی در زیرکی خلدی در ایمنی
دهری در کین‌کشی چرخی در دشمنی
خاکی در احتمال آبی در روشنی
بادی در سرکشی ناری در توسنی
اهل زمین فوج فوج خلق زمان خیل خیل
سیم ستانند و زر از کف تو کیل کیل
گوهر گیرند و لعل روز و شبان ذیل ذیل
گاه سخا کوه کوه وقت عطا سیل سیل
خندهٔ تو گاه خشم خندهٔ شیر نرست
هرکه نگرید از آن خنده ز شیراشیرست
قافیه گو جعل باش جعل ز من درخورست
حشمت من در سخن صد ره از آن برترست
ملک نژادا چو من جهان نزاید همی
پس از من ای بس حکیم که می‌بیاید همی
به مرگ من پشت دست ز غم بخاید همی
دو دست خویش از اسف بهم بساید همی
تا که زمین روز و شب‌‌ گردد بر گرد شمس
تا که بتازی زبان روز گذشته است امس
تا که حواس است‌ عشر ظاهر از آن‌ عشر خمس
سامعه و باصره ناطقه و شمّ و لمس
بت سادهٔ رفیق بط بادهٔ رحیق
مرا به ز صد حشم مرا به ز صد فریق
نخواهم غذای روح به جز بادهٔ رقیق
نجویم انیس دل به جز سادهٔ رفیق
بحمدالله از بتان مرا هست دلبری
به طلعت فرشته‌ای به قامت صنوبری
به رخ ماه نخشبی به قد سرو کشمری
به دل سنگ خاره‌ای به تن کوه مرمری
خطش‌ یک ‌قبیله مور رخش یک حدیقه‌ گل
تنش یک دریچه نور لبش یک قنینه مل
خطش ماه را ز مشک به گردن فکنده غل
لبش بر چَه ِ عدم ز یاقوت بسته پل
خرامنده‌تر ز کبک سیه چشم‌تر ز وعل
دهان نیستش وزو سخن‌ها کنند جعل
ز عشق وی ابرویش در آتش فکنده نعل
رخش از نژاد گل لبش از نتاج لعل
نخواهم کسی گزید ازین پس به جای او
که هرگز ندیده‌ام بتی با وفای او
چو جاوید زنده است دلم در هوای او
سزد گر به زندگی بمیرم برای او
چو خواهم ازو شراب دوَد گرم در وثاق
صراحیّ و جام را فرود آورد ز طاق
بریزد ز دست خویش‌ می از شیشه در ایاق
پس‌ آنگاه به دست من دهد با صد اشتیاق
چو من درکشم قدح سراید که نوش‌ باد
به قول قلندران همه جزو هوش باد
هزار آفرین ترا به جان از سروش باد
به جز در ثنای تو زبان‌ها خموش باد
فلک فر علیقلی که جودش بود فره
به رویش‌ ندیده کس مگر روز کین گره
ز سهم خدنگ او چو بیرون جهد ز زه
کند ماه آسمان چو ماهی به تن زره
دلش بیتی از کرم مکارم نجود او
فلک رفته در رکوع ز بهر سجود او
نماید در جهان همه شکر جود او
تنی هست روزگار روانش وجود او
ز رایش به مویه ماه ز جودش به ناله نیل
هم از فضل بی‌منال هم از عدل بی‌عدیل
سخن‌های او بلند سخایای او جمیل
کرم‌های او بزرگ عطاهای او جزیل
ز رخسار شاملش زمین روضهٔ ارم
ز انصاف کاملش جهان حوزهٔ حرم
به یک ره چو آفتاب کفش پاشد از کرم
به قدر ستارگان اگر باشدش درم
زهی بخت حاسدت شب و روز در رقود
به میزان خشم او تن دشمنان وقود
کمان از تو ممتحن چنان کز محک نقود
سزد عقد جو ز هر کمند ترا عقود
پرد تا به عون پر همی طیر در هوا
دود تا به زور گام همی رخش در چرا
دمد تا به فرودین همی از زمین گیا
رسد تا به بندگان ز شاهان همی عطا
ترا یسر در یسار ترا یمن در یمین
به‌ ارزاق خاص و عام دل و دست تو ضمین
ملک گویدت ثنا فلک بوسدت زمین
جهان با همه جلال ترا بندهٔ کمین
الا که مژده می‌برد به یار غمگسار من
که باغ چون نگار شد چه خسبی ای نگار من
توان من روان من شکیب من قرار من
سرور من نشاط من بهشت من بهار من
دهند مژده نوگلان که نوبهار می‌رسد
به شیر او ز بلبلان نه یک‌، هزار می‌رسد
نسیم چون قراولان ز هر کنار می‌رسد
به‌ گوش من ز صلصلان خروش تار می‌رسد
بهار را چه می کنم بتا بهار من‌ تویی
ز خط و زلف عنبرین بنفشه‌زار من تویی
هزار و گل چه بایدم گل و هزار من تویی
به روزگار ازین خوشم که روزگار من تویی
مرا نگار نیک‌پی شراب ملک ری دهد
شرابهای ملک ری مرا کفاف کی دهد
بلی کفاف کی دهد شرابها که وی دهد
مگر دو چشم مست وی کفایتم ز می دهد
نگر کران راغ‌ها چه سبزها چه کشتها
ز لاله‌ها به باغ‌ها فراز خاک و خشت‌ها
عیان نگر چراغ‌ها شکفته بین بهشت‌ها
نموده تر دماغ‌ها چه خوب‌ها چه زشتها
دمن شد ای پسر یمن شقیق‌ها عقیق‌ها
نشسته مست در دمن شفیق‌ها رفیق‌ها
چمیده جانب چمن رفیق‌ها شفیق‌ها
گسارده به رطل و من عتیق‌ها رحیق‌ها
ملاذ و ملجاء مهان خدیو زادهٔ مهین
عطیه بخش راستان خدایگان راستین
سپهرش اندر آستان محیطش اندر آستین
به‌ صد قرون ز صد قران فلک نیاردش قرین
سلیل خسرو عجم فرشته فر علیقلی
چراغ دودمان جم به بخردی و عاقلی
همال ابر در کرم مثال ببر در یلی
هلاک جان گستهم ز پهلوی و پر دلی
به ‌روز کین که‌ جایگه به ‌پشت رخش می‌کند
چو سنگریزه کوه را ز گرز پخش می کند
به خنجری که خندها به آذرخش می کند
سر و تن حسود را هزار بخش می کند
اگر فتد ز قهر او به نه فلک شراره‌ای
به یک سپهر ننگری نسوخته ستاره‌ای
ز روی خشم اگر کند به لشکری نظاره‌ای
گمان مبر که جان برد پیاده‌ای سواره‌ای
اگر به گاه کودکی خرد نبود مهد او
به‌‌ کسب دانش این‌ قدر ز چیست جد و جهد او
به خاک اگر دمی دمد عقیق پر ز شهد او
تمام نیشکر شود نبات‌ها به عهد او
اگر چه بهره‌ای مرا ز مال روزگار نی
چو والیان مملکت شکوه و اقتدار نی
حمال نی خیول نی بغال نی حمار نی
جلال نی جیوش نی پیاده نی سوار نی
همیشه تا بود مکان به بحر آبخوست را
هماره تا در آسمان نحوستست بست را
تقابل است تا به هم شکسته و درست را
چنانکه تند و کند را چنانکه سخت و سست را
همیشه تا که نقطه‌ای بود میان دایره
که هرخطی که برکشی از آن به سوی چنبره
مرآن خطوط مختلف برابرند یکسره
حسود باد صید او چو صید باز قبره"
